title,content,url,cnt,source,keyword,image,createdAt
2019 카카오 블라인드 공채 2차 오프라인 코딩 테스트 문제 해설,"지난 10월 6일(토) 2019 블라인드 공채 오프라인 2차 코딩테스트가 진행되었습니다. 작년에는 8시간 동안 온라인으로 진행한 것과는 달리 오프라인으로 5시간 동안 치러졌는데요, 어떤 의도로 출제하였는지 살펴보겠습니다.작년 문제 출제 의도를 기억하시는지요?작년 문제에는 매우 많은 장치가 숨겨져 있었으나 정작 요구사항을 그대로 구현하기만 해도 합격선인 8만 점을 얻기에는 충분했었습니다.그리하여 올해는 시스템 디자인 역량을 좀 더 중점적으로 평가하고자 하였습니다.올해 오프라인 2차 테스트 문제는 다수의 엘리베이터(1대~4대)를 제어하는 시스템을 구현하는 것입니다. 핵심 구현에 집중할 수 있도록 엘리베이터 동작 및 상태는 서버에서 관리하고, 서버와 통신은 작년과 같이 REST API 및 JSON 포맷으로 주고받도록 하였습니다.지원자는 주어진 빌딩별 승객 트래픽을 분석하여 가정 적합한 엘리베이터 제어 알고리즘을 구현해야 합니다.지원자가 제어할 엘리베이터 시스템은 다음과 같습니다.명령에 따른 status 전환을 그림과 표로 표현하면 아래와 같다.엘리베이터 1대의 동작은 대부분 지원자에게 친숙할 것입니다. 우리가 실생활에서 자주 접하는 엘리베이터 알고리즘은 “collective control”, “elevator algorithm” 등으로 불리는데 아래와 같이 2가지 규칙으로 구성됩니다.간단하고 직관적인 알고리즘입니다. 운영체제 수업을 열심히 들은 학생이라면 디스크 스케줄링 알고리즘 중 하나인 look 알고리즘을 떠올릴 수도 있겠습니다.반면, 복수의 엘리베이터를 제어하기 위해서는 추가로 승객의 요청을 어느 엘리베이터에 할당할 것인지를 결정해야 합니다. 얼핏 보면 간단해 보이는 이 요구사항의 추가로 시스템은 제법 복잡해지게 됩니다. 어느 엘리베이터에 승객을 할당하는 것이 효율적인지 비용 계산을 해야 하고, 승객이 어디에 탑승하고 있는지를 관리해야 합니다. 층별로 구역을 나누어 운행한다면(홀/짝, 고층/저층 분리 운영 등) 환승 기능도 구현해야 합니다.1대의 엘리베이터 제어는 쉽고 간단해 보이지만, 3문제를 모두 풀기 위해서는 반드시 복수 엘리베이터를 제어해야 합니다. 또한 각 문제의 승객 패턴도 다르고, 승객 패턴에 따라 효율적으로 엘리베이터를 구성해야 합니다. 따라서 시스템 디자인 시 다양한 엘리베이터 알고리즘을 실험할 수 있도록 추상화 & 모듈화를 통해 변경에 유연하도록 디자인해야 합니다. 실제 내부 모의 검증 시에도 문제 요구사항 분석 없이 1대만 먼저 운행하는 식으로 시작한 피실험자의 경우, 여러 대를 제어하는 시스템으로 리팩토링하는 단계에서 시간을 너무 소모하여 시간 내에 문제를 다 풀지 못하는 경우가 속출하였습니다.엘리베이터 요청은 크게 3가지로 분류할 수 있습니다. (빌딩의 입구는 1층이라고 가정) (참고: https://beta.vu.nl/nl/Images/werkstuk-boer_tcm235-91327.pdf)이번 테스트에서는 총 3개의 빌딩을 제시했습니다.첫 번째 어피치 맨션의 경우 5층 높이의 작은 맨션이고 총 요청은 6개입니다. 쉬운 문제를 통해 엘리베이터 시스템에 익숙해지고 API 연동을 해보는 몸풀기 문제라 할 수 있습니다.두 번째 제이지 빌딩은 25층 건물에 요청은 200개입니다. 위의 3가지 타입의 요청이 적절히 섞여 있는 가장 일반적인 형태의 모델이라고 할 수 있습니다.세 번째 라이언 타워는 25층 건물에 요청은 500개입니다. 라이언 타워는 승객의 패턴을 제공하고, 이에 맞는 효율적인 엘리베이터 분배 알고리즘을 구현하도록 유도한 문제입니다. 입구는 1층이고, 2층-12층은 개별 회사에 임대를 하고, 13층-25층은 카카오가 사용합니다. 따라서 2층-12층 내에서는 층간 이동이 거의 없는 반면, 13층-25층 사이에서는 층간 이동이 빈번합니다. 또한 13층에 카카오프렌즈샵이 위치하여 1층과 13층을 오가는 고객들이 많다는 상황을 설정하였습니다.가장 쉬운 접근법입니다. 요청이 들어온 순서대로 태우고 목적지에 내려준 후 다음 요청을 처리하는 형태입니다. 어피치 맨션의 경우 이 접근으로도 쉽게 풀립니다만, 제이지 빌딩, 라이언 타워의 경우 각각 약 4000, 13000 timestamp로 좋은 점수를 받을 수 없습니다.위에서 설명한 collective control 알고리즘입니다. 가장 친숙한 동작 방식입니다. 1대만 사용했음에도 불구하고 제이지 빌딩에서 972의 timestamp를 기록할 정도로 효율적입니다. 라이언 타워의 경우 약 2000 timestamp를 기록할 수 있습니다.이번 문제의 엘리베이터는 보통의 엘리베이터와 다른 점이 있습니다. 이 부분을 활용하면 고득점을 할 수 있는데요. 출제진도 예상하지 못한 다양한 접근 방법들이 나와 놀랐습니다. 어떤 것들이 있는지 살펴보겠습니다.0번 엘리베이터를 주목해주세요. 3명의 승객을 태우고 올라가던 엘리베이터는 17층에서 승객 1명을 내려주고 내려가는 방향의 승객 2명을 태워 올라갑니다. 일반적인 알고리즘과는 다른 방식인데요. 힌트는 평가 방법에 있습니다. 평가 조건은 모든 승객을 목적 층으로 수송해야 하며 가장 마지막 승객이 목적 층에 하차하였을 때의 시간 기준으로 평가를 합니다. 따라서 엘리베이터 내에 공간이 충분하다면 문이 열린 김에 태워가는 것이, 방향 전환 후 다시 멈추고, 문을 열고, 탑승시키는 것보다 효율적입니다.마찬가지로 승객의 요청이 들어왔을 때 바로 요청을 처리하지 않고 대기하는 지원자도 있었습니다. 승객을 태우기 위해 멈추고, 문을 열고, 닫고, 태우는 것이 모두 timestamp를 잡아먹기 때문에 충분히 기다렸다가 한꺼번에 태우는 것입니다. 또한 대기 중인 승객의 수에 따라 엘리베이터 이동 전략을 달리한 지원자도 있었습니다.그리고 결정적으로 현실의 엘리베이터와 차이가 나는 부분이 있습니다. 바로 요청을 받을 때 목적 층을 사전에 알 수 있다는 것입니다. 이 정보를 토대로 엘리베이터에 승객을 가고자 하는 층별로 그룹화하여 탑승시킬 수 있습니다. 심지어 엘리베이터를 움직이기 전에 모든 승객의 요청을 다 수집한 후에 움직이기 시작한 지원자도 있었습니다.Python이 압도적으로 높은 비율을 보였고 그 뒤를 Java와 Node가 뒤이었습니다.빌딩별 가장 먼저 성공한 시각은 14시 12분 / 14시 40분 / 14시 53분입니다. 어피치 맨션을 2시간 30분 이내에 풀어야 남은 두 빌딩을 최적화하여 고득점 할 수 있을 것이라 예상하였는데, 예상외로 후반부의 집중력이 놀라웠습니다.2차 오프라인 코딩테스트에서 사용한 엘리베이터 시뮬레이션 서버는 직접 돌려볼 수 있도록 수정하여 공개하였습니다. 이 곳에서 내려받아 실행할 수 있습니다.긴 시간 동안 문제 푸시느라 고생하셨습니다! 당락을 떠나 즐겁고 유익한 문제였기를 바랍니다",http://tech.kakao.com/2018/10/23/kakao-blind-recruitment-round-2/,0,kakao,"react,backend,xml,frontend,javascript",NULL,2018-10-23
if kakao 2018 동영상을 공개합니다.,"지난 9월 4일, 코엑스 그랜드볼룸에서 카카오의 개발자 콘퍼런스인 if kakao 2018이 성황리에 마쳤습니다.카카오 이름을 건 첫 번째 개발자 콘퍼런스인 if kakao 2018은 인공지능, 메신저, 택시, 결제/송금, 검색 등 수많은 영역에서 쌓은 카카오의 기술과 노하우를 외부에 공유하고 소통하는 자리였구요.신정환 CTO와 김병학 AI Lab 총괄 부사장의 기조연설과 인공지능, 머신러닝, 멀티미디어 처리, 챗봇, 클라우드, 오픈소스, 추천 등 다양한 주제의 27개 강연 세션을 진행했으며, 카카오의 서비스를 만드는 현직 개발자들이 실제 개발 사례를 중심으로 기술과 노하우를 생생하게 전달하려고 노력했습니다.이번 행사의 스케치 영상을 포함해 기조연설과 모든 강연 세션 동영상을 공개합니다.if kakao 2018 콘퍼런스의 모든 영상은 카카오TV의 if kakao dev 2018 채널에서 확인할 수 있습니다. 아쉽게도 행사에 참석하지 못한 분들 뿐만 아니라, 행사에 참석했던 분들에게도 세션 내용을 다시 확인하는데 도움이 되었으면 합니다.내년에는 더욱 멋진 콘퍼런스를 준비해서 찾아뵙겠습니다. 감사합니다.",http://tech.kakao.com/2018/10/17/if-kakao-dev-2018/,0,kakao,"frontend,javascript,ruby",NULL,2018-10-17
