title,content,url,cnt,source,keyword,image,createdAt
"Tech event calendar 2018-19: Upcoming shows, conferences and IT expos"," Tech Events Event Description Starts Ends Location Splash 2018 ACM SIGPLAN conference on Systems, Programming, Languages and Applications: Software for Humanity embraces all aspects of software construction and delivery. At the intersection of programming, languages, and software engineering. 2018-11-04 2018-11-09 Boston, MA EARL Houston Enterprise Applications of the R Language conference 2018-11-09 2018-11-09 Houston, TX EARL Boston Enterprise Applications of the R Language conference 2018-11-13 2018-11-13 Cambridge, MA IT Roadmap This one-day event focused on powering the agile enterprise looks at the latest approaches to make IT more responsive, nimble, and robust. 2018-11-15 2018-11-15 Fort Worth, TX AWS re:Invent AWS Re:invent is Amazon's opportunity to update IT and business leaders on the latest features of its cloud service.The event features keynote announcements, training and certification opportunities, access to more than 2,000 technical sessions, a partner expo, and more. 2018-11-26 2018-11-30 Las Vegas, NV Blockchain Expo The ""World's largest Blockchain Conference and Exhibition"" focuses on the future of enterprise IT, with two days of information and insights about embracing and developing cutting-edge blockchain technologies. 2018-11-28 2018-11-29 Santa Clara, CA IT Roadmap This one-day event focused on powering the agile enterprise looks at the latest approaches to make IT more responsive, nimble, and robust. 2018-12-06 2018-12-06 Washington, D.C. RStudio Conference 2019 Hadley Wickham hosts this conference on all things R and RStudio aimed at helping attendees become better at data science with R. 2019-01-15 2019-01-18 Austin, TX MWC Barcelona The original Mobile World Congress, now renamed MWC Barcelona, addresses a wide range of mobile topics, from AI to Digital Wellness, Digital Trust and connectivity in general. 2019-02-25 2019-02-28 Barcelona, Spain RSA Conference USA Expert-led sessions, keynotes and seminars covering the latest cybersecurity developments. 2019-03-04 2019-03-08 San Francisco, CA SXSW Covering everything from entertainment to entrepreneurship, this sprawling conference has tracks dedicated to Tech Industry &amp; Enterprise, Coding &amp; Development, Blockchain &amp; Cryptocurrency, Health &amp; Medtech, and VR/AR/MR. 2019-03-08 2019-03-17 Austin, TX Enterprise Connect Aimed at companies looking to upgrade or replace legacy systems or deploy and integrate next-gen communications and collaboration systems, services, apps and networks. 2019-03-18 2019-03-21 Orlando, FL AGENDA19 Each year the focus of IDG's business leadership conference aligns with the most pressing business and technology issues of the day. 2019-03-18 2019-03-20 Ponte Vedra Beach, FL Atlassian Summit Atlassian's annual user conference and biggest global event of the year. Aimed at helping companies transform how their teams work, and tout the company's latest innovations. 2019-04-09 2019-04-11 Las Vegas, NV Google Cloud Next Google Cloud Next is where the company announces all the latest updates to the Google Cloud Platform. The conference also offers educational, networking and hands-on opportunities for its more than 10,000 attendees. 2019-04-09 2019-04-11 San Francisco, CA Slack Frontiers 2019 (SF) At Frontiers, Slack shares best practices to help leaders and their teams create the right conditions for collaboration. You'll explore how new ways of working through Slack can accelerate performance, bring bigger gains, and keep your organization competitive as you boldly chart the new frontiers of work. 2019-04-23 2019-04-25 San Francisco, CA Computex Taipei Based in Asia, this massive technology trade show and expo focuses on information and communications technology, supply chain and IoT ecosystems. 2019-05-28 2019-06-01 Taipei, Taiwan Microsoft Inspire Microsoft's partner-centric tech conference. 2019-07-14 2019-07-18 Las Vegas, NV Black Hat USA Four days of hands-on security training followed by the two-day main conference covering the information security research, development and trends. 2019-08-03 2019-08-08 Las Vegas, NV MWC Americas MWC Americas focuses on how mobile is changing the world, with a look at areas such as innovation, policy, networks, media and entertainment and the coming ""Fourth Industrial Revolution."" 2019-10-22 2019-10-24 Los Angeles, CA Dreamforce Annual conference for Salesforce customers, featuring keynotes, training, certification opportunities, hands-on demos, and more. 2019-11-19 2019-11-22 San Francisco, CA WWDC Apple's Worldwide Developers conference, where the company usually showcases updates to iOS and macOS. NA NA San Jose, CA Google I/O Google's annual developer conference offers in-depth sessions on the company's latest developer tools and provides a sneak peek at upcoming products. NA NA Mountain View, CA Microsoft Build Microsoft typically uses its annual developers' conference as a showcase for new products and technologies related to Windows and Azure. The event offers attendees hands-on workshops, demos, an expo hall, networking opportunities and more. NA NA Seattle, WA To read this article in full, please click here",https://www.computerworld.com/article/3313417/it-industry/tech-event-calendar-2018-19-upcoming-shows-conferences-and-it-expos.html#tk.rss_all,0,computerworld,"xml,frontend,css,java,python,backend,php,typescript,react,javascript,angular",NULL,2018-11-09
"Great R packages for data import, wrangling and visualization"," One of the great things about R is the thousands of packages users have written to solve specific problems in various disciplines -- analyzing everything from weather or financial data to the human genome -- not to mention analyzing computer security-breach data.[ Need to learn R or brush up on basics? Download our free Beginner's Guide to R or the Advanced Beginner's Guide to R ] Some tasks are common to almost all users, though, regardless of subject area: data import, data wrangling and data visualization. The table below show my favorite go-to packages for one of these three tasks (plus a few miscellaneous ones tossed in). The package names in the table are clickable if you want more information. To find out more about a package once you've installed it, type help(package = ""packagename"") in your R console (of course substituting the actual package name ).To read this article in full, please click here",https://www.computerworld.com/article/2921176/business-intelligence/great-r-packages-for-data-import-wrangling-visualization.html#tk.rss_all,0,computerworld,"python,react,frontend",NULL,2018-11-09
How to use your iPad Pro to replace your laptop (Part 4)," I’m trying to show how Apple’s iPad Pro sets new boundaries for mobile computing and offers a real alternative to a laptop for many of us.Today we’re taking a look at the Files app and how to use it effectively with an iPad.[ Related: Apple's place is in the enterprise ] Episode guide: Part One: iPad Equipment Part Two: Keyboard, Typing, Shortcuts, and Dictation tips Part Three: How to multitask on iPad Pro Part Four (this episode): How to use Apple’s Files app and tags What is Files? Files is a cloud-based data storage system that is compatible with Macs, iPhones, and iPads and works to make sure all your information is accessible to you when you are logged in with your Apple ID.To read this article in full, please click here",https://www.computerworld.com/article/3320020/mobile-wireless/how-to-use-your-ipad-pro-to-replace-your-laptop-part-4.html#tk.rss_all,0,computerworld,,NULL,2018-11-09
IDG Contributor Network: The lock-in problem hiding behind Apple’s unit sales declines," I hate lock-in. Lock-in is when you wrap a product up with so much proprietary stuff that the customer can’t move to a competing offering. The advantage to the company is that they dramatically reduce customer churn—thus reducing the need for marketing—and can focus sales efforts more on acquiring new customers, rather than keeping existing customers happy.That last part is also the problem, because once lock-in is achieved, companies tend to defund efforts to keep customers happy…and increasingly focus on raising prices as a way to raise revenues. Companies that embrace this strategy effectively morph from being customer-focused to being more like organized crime and a protection racket. You don’t buy because you want to, you buy because you don’t have a choice.To read this article in full, please click here",https://www.computerworld.com/article/3319669/apple/the-lock-in-problem-hiding-behind-apples-unit-sales-declines.html#tk.rss_all,0,computerworld,"angular,typescript,webpack,css,frontend",NULL,2018-11-09
Amazon’s Alexa virtual assistant now available on Windows 10 PCs as a standalone app," Alexa debuted on select Windows 10 laptops earlier this year – built into a range of newly launched HP, Asus, Acer and Lenovo notebooks – and is now available for download on all compatible devices.There are no PC-specific controls for Alexa at this point, but Amazon said it plans to add “PC-specific capabilities” early in 2019. Moving beyond managing entertainment and smart home apps, Alexa’s presence on Windows 10 is aimed at work productivity and serves to highlight the AI assistant’s rise in office environments – much as the iPhone in 2007 moved quickly from individual users to become a mainstay of the workforce.There are now more that 25,000 Alexa skills available, including a growing list targeted specifically at business users.To read this article in full, please click here",https://www.computerworld.com/article/3246636/collaboration/amazons-alexa-virtual-assistant-now-available-on-windows-10-pcs-as-a-standalone-app.html#tk.rss_all,0,computerworld,,NULL,2018-11-09
Not the timesheet issue we were expecting," Pilot fish is the new hire at this IT consulting outfit -- in fact, he's fresh out of college when he's sent to work on his first project.""I followed the lead of the senior consultant on the project, Barney,"" says fish. ""He told me how many hours we worked each day, how to fill out timesheets, how long a lunch we could take -- longer when he felt like it -- and so on.""After about two months, fish gets a phone call from the consulting firm's office administrator, Wilma, who berates him for not filling out his timesheets correctly.She informs fish that the workday is seven hours, not eight, and that he shouldn't be putting eight hours down on his timesheet, and that she's not happy about all the extra work he's causing her.To read this article in full, please click here",https://www.computerworld.com/article/3319666/it-careers/not-the-timesheet-issue-we-were-expecting.html#tk.rss_all,0,computerworld,,NULL,2018-11-09
Microsoft cheat sheets: Dive into Windows and Office apps," Need to get up to speed on the latest features in Excel 2016? Wrestling with an old version of Word? Looking to get more out of Windows 10? Computerworld’s cheat sheets are easy-to-use guides to help you navigate Microsoft's core productivity apps.Here's a one-stop resource where you can find in-depth stories on several generations of Word, Excel, PowerPoint, and Outlook for Windows, focusing on what's new in each major release. We've also got guides for SharePoint, OneNote, Microsoft Teams and Windows itself.Microsoft's subscription-based office suite, Office 365, is continually updated with new features, and the company has just released Office 2019, its latest non-subscription office suite. We'll be publishing new cheat sheets to cover those products, but we're willing to bet that many companies and individuals will stay on older versions of the standalone software for some time to come. We've got you covered here.To read this article in full, please click here",https://www.computerworld.com/article/3199247/microsoft-office/ultimate-guide-to-older-office-apps-microsoft-cheat-sheets.html#tk.rss_all,0,computerworld,,NULL,2018-11-08
9 handy hidden features for Google Maps on Android," Who doesn't love Google Maps? The native Android app helps those of us with oatmeal for brains find our way anywhere, without having to fire any neurons or exercise any synapses. It even helps us find places to pick up tasty cuisine — like, uh, oatmeal (yum!).But there's much more to Google Maps than meets the eye — and odds are, you aren't taking advantage of at least a few handy hidden features lurking in the Android app. With word that Google is now apparently testing Waze-like crash and speed test reporting within Maps, I thought it'd be a fine time to think through some of the app's existing advanced options.To read this article in full, please click here",https://www.computerworld.com/article/3319439/android/google-maps-android-features.html#tk.rss_all,0,computerworld,,NULL,2018-11-08
How to use your iPad Pro to replace your laptop (Part 3)," We’ve looked at some of the equipment we should carry and learned everything we need to type effectively on an iPad Pro. Now we’re going to take a look at the built-in multi-tasking features in the Apple tablet.Welcome to the third episode in the multi-part guide to help you use an iPad Pro instead of a notebook.[ Read also: Adobe has killed the ‘iPad is not productive’ story ] Episode guide: Part One: iPad Equipment Part Two: Keyboard, Typing, Shortcuts, and Dictation tips Part Three: How to multitask on iPad Pro Part Four: How to use Apple’s Files app and tags Apple has been working hard to develop multitasking on iPad Pro. Features such as Slide Out and Split View help you work within multiple apps, while the Most Recent apps included to the right of the Dock helps to make sure the software you need to use is easily available to you.To read this article in full, please click here",https://www.computerworld.com/article/3320076/mobile-wireless/how-to-use-your-ipad-pro-to-replace-your-laptop-part-3.html#tk.rss_all,0,computerworld,,NULL,2018-11-08
Recode Daily: Amazon’s HQ2 — a grail for two cities," Plus: Facebook will allow France to “embed” a team of regulators to examine how it combats hate speech; R.I.P. superhero’s superhero Stan Lee; Bring Your Parents to Work Day. Amazon has finally announced the location(s) of its new headquarters: Northern Virginia — in the newly defined neighborhood of “National Landing” — outside of Washington, D.C., and Long Island City, Queens, situated across the East River from Manhattan. These choices were not inspiring choices but data-based ones; the embodiment of Amazon’s emotionless practicality. Here’s what Amazon HQ2 employees will face in Long Island City when it comes to transportation, housing and … sewage. And here’s how the two “winning” locations compare to Amazon’s original hometown of Seattle and the country at large. [Jason Del Rey / Recode] Facebook will allow a team of French regulators to “embed” inside the company to examine how it combats online hate speech — the first time the wary tech giant has opened its doors in such a way. Speaking at the Paris Peace Forum, French President Emmanuel Macron said that the trial project is an example of what he has called “smart regulation,” something he wants to extend to other tech leaders such as Google, Apple and Amazon; the six-month embed is scheduled for next year. Macron also released an international agreement on cybersecurity principles; the Paris Call for Trust and Security in Cyberspace was signed by 50 nations, 130 private sector groups and 90 charitable groups and universities, but not the United States, Russia or China. [Mathieu Rosemain, Michel Rose and Gwénaëlle Barzic / Reuters] Small U.S. cable companies want the Department of Justice to reinvestigate Comcast’s 2011 merger with NBCUniversal. The American Cable Association, a group that represents a collection of small and independent cable companies, sent a letter to the DOJ requesting that officials open a formal investigation, saying that the deal poses “a much greater threat to competition” than AT&amp;T’s recent merger with Time Warner. Government restrictions attached to the deal had limited Comcast’s ability to harm consumers, but those restrictions expired over the summer, opening the door to questionable business tactics such as withholding NBC’s television programming from competing cable providers. [Brian Fung / The Washington Post] You know Jony Ive for the distinct mix of understatement and elegance he brings to the designs of Apple products. Apple’s chief design officer has been working on something a little different: A diamond ring. Unlike most diamond rings that have a metal band made of gold or silver, Ive decided to “think different” and instead created the entire ring out of diamonds. Rather than being sold in a jewelry store, the one-of-a-kind ring will be sold exclusively at a Sotheby’s auction to raise funds to help eliminate HIV/AIDS in eight African countries. The ring, which will be made to fit the buyer, is expected to sell for between $150,000 and $250,000 at the Dec. 5 auction in Miami. Meanwhile, jewelry that belonged to Marie Antoinette, wife of King Louis XVI and arguably France’s most famous queen, is headed to the Sotheby’s auction block in Geneva, Switzerland on Wednesday, Nov. 12. [Jeff John Roberts / Fortune] RIP, Stan Lee, the superhero of superheroes. The legendary writer, editor and publisher of Marvel Comics was responsible for such iconic characters as Spider-Man, the X-Men, Thor, Iron Man, Black Panther and the Fantastic Four. On his own and through his work with frequent artist-writer collaborators Jack Kirby, Steve Ditko and others, Lee catapulted Marvel from a tiny venture into the world’s No. 1 publisher of comic books and, later, a multimedia giant. In 2009, The Walt Disney Co. bought Marvel Entertainment for $4 billion, and most of the top-grossing superhero films of all time have featured Marvel characters. Here are 12 things you might have learned over two decades of lunches with Lee; and here is Lee’s vision of the American dream. [Mike Barnes / The Hollywood Reporter] Top stories from Recode Amazon is dominant online, but local retail still has advantages Jeff Bezos can’t replicate. Sometimes it’s worth putting on your shoes and taking a walk. [Kara Swisher] The exec who built Snapchat Discover is leaving the company. Nick Bell is stepping down following some recent management changes and four-plus tumultuous years. [Kurt Wagner] Former Deputy Attorney General Sally Yates explains how Donald Trump is trying to corrupt the Justice Department. On the latest episode of Recode Decode, Yates talked about how things have changed since she was fired in Week Two of the Trump administration. [Kara Swisher] Is Daily Beast the new Gawker? On the latest Recode Media, the site’s new editor in chief, Noah Shachtman, says he wants to take “full, big, considered swings” at the targets who deserve it. [Steven Perlberg] This is cool Bring Your Parents to Work Day. ",https://www.recode.net/2018/11/13/18089806/amazon-hq2-long-island-city-crystal-facebook-france-embed-comcast-merger-doj-stan-lee-marvel,0,recode,"java,react,php,frontend",NULL,2018-11-13
"Here’s what Amazon HQ2 employees will face in Long Island City when it comes to transportation, housing and ... sewage"," A lot of change is on the horizon for the Queens neighborhood. Amazon’s 14-month-long contest for a second headquarters is finally over. But for the two locations it ultimately chose — an area of Northern Virginia Amazon is calling “National Landing” and Long Island City, New York — the journey has just begun. The addition of Amazon’s HQ2 means that potentially 25,000 new employees will swarm each of those areas in the coming years. Long Island City, located in the biggest city in the U.S. — where overcrowding, aging infrastructure and a high cost of living present unique challenges — will surely be the trickier location of the two. Here’s a look at what Amazon and its employees will have to face in Long Island City. Transportation If you travel in NYC, you know that the subway delays have been awful. They’re somewhat less awful in Long Island City. Three of the major train lines in the area — the 7, G and E — were on time 85, 83 and 81 percent of the time, respectively, during weekdays in September, according to the MTA’s subway performance dashboard. That’s higher than the system-wide average of 80 percent on-time. The M train, however, was only punctual 76 percent of the time in September. The MTA is currently working on a new signal system for the 7 line that will allow at least two more trains per hour. It’s expected to be completed by the end of the year. New York City’s subway trouble, however, is not isolated to each subway line. “It’s a network that’s only as strong as its weakest link and it’s suffering right now tremendously,” according to Danny Pearlstein, policy and communications director for transit advocacy group Riders Alliance. “The question for the six million daily riders is, ‘Will the state come up with a plan to rescue the subway system?’” Performance of Long Island City’s major trains are highlighted in blue below: if(""undefined""==typeof window.datawrapper)window.datawrapper={};window.datawrapper[""r5CuK""]={},window.datawrapper[""r5CuK""].embedDeltas={""100"":793,""200"":692,""300"":650,""400"":650,""500"":633,""700"":633,""800"":633,""900"":633,""1000"":633},window.datawrapper[""r5CuK""].iframe=document.getElementById(""datawrapper-chart-r5CuK""),window.datawrapper[""r5CuK""].iframe.style.height=window.datawrapper[""r5CuK""].embedDeltas[Math.min(1e3,Math.max(100*Math.floor(window.datawrapper[""r5CuK""].iframe.offsetWidth/100),100))]+""px"",window.addEventListener(""message"",function(a){if(""undefined""!=typeof a.data[""datawrapper-height""])for(var b in a.data[""datawrapper-height""])if(""r5CuK""==b)window.datawrapper[""r5CuK""].iframe.style.height=a.data[""datawrapper-height""][b]+""px""}); Tax incentives Much of Long Island City is located within Opportunity Zones, economically distressed areas where new investments could be eligible for preferential tax treatment, according to Economic Innovation Group, a nonpartisan public policy organization. These investments are currently trendy among the tech industry’s wealthiest. Those areas are highlighted on the map below in orange. New York Governor Andrew Cuomo is considering bypassing the normal process to rezone a 20-acre area along the Long Island City waterfront — which falls in Opportunity Zone territory — for Amazon use, according to Crain’s New York. Currently, the area is only zoned for low-rise manufacturing use. Housing Long Island City is the top New York City neighborhood for new residential development, so it has ample new housing for Amazon workers. About 3,000 units were completed in the first half of 2018, according to Localize.city, a New York City real estate platform that analyzed Department of Building data. Some 3,300 more are expected to be completed by 2020 — that represents about a fifth of all new units citywide. As a result of all this construction, rental prices have been in decline in the area. The addition of thousands more residents from Amazon, however, will likely stanch that fall. Below is a Localize map of all new LIC residential buildings from Jan. 1, 2008 to July 1, 2018. Lighter-colored buildings are still under construction. Commercial space Long Island City has a much higher office-vacancy rate — 24 percent — than even the U.S. at large (12 percent), according to real estate services company Cushman &amp; Wakefield. That means, should Amazon choose to lease existing office space, it would have a relatively easy time. That’s especially the case as several high-profile office tenants have left the area — including Citigroup. (Update: Citigroup now says Amazon plans to move into its tower at 1 Court Sq.) In general, LIC hasn’t historically been a major office market. High-end office space in LIC is also much cheaper than in Manhattan, at $48.20 a square foot compared with $84.17 in Midtown, according to Cushman. Infrastructure investment LIC’s infrastructure is already stretched thin — and that’s before adding an additional 25,000 Amazon employees. Luckily for — and perhaps because of — Amazon, the city recently committed to investing $180 million in the area. That includes $95 million earmarked for the area’s ailing sewer system and water mains. Here’s a map of Long Island City’s planned water and sewer improvements. The investments also include $60 million for a new school in the Court Square area, $15 million for parks and open-space improvements, and $10 million for street reconstruction to “provide safer connections for pedestrians and bicyclists.” That’s good, because Long Island City has more reports of blocked bike lanes than all of New York City, according to Localize. It also ranks first for the most parking complaints — more than 4,000 a year. The area also faces a shortage of essential amenities such as supermarkets and pharmacies, though perhaps a new Amazon Go store could fix that; Amazon’s first Amazon Go store sits on the ground floor of Amazon’s new Seattle headquarters. As far as other stores, 500,000 square feet of new retail space is expected by the early 2020s. ",https://www.recode.net/2018/11/13/18088830/amazon-hq2-new-york-queens-long-island-city-headquarters-transportation-subway-housing,0,recode,python,NULL,2018-11-13
