title,content,url,cnt,source,keyword,image,createdAt
Windows 10 October 2018 Update: Key enterprise features,"The latest version of Windows 10 has many monikers. Its version number is 1809, its code name was Redstone 5, and its official name, announced by Microsoft at IFA Berlin, is the Windows 10 October 2018 Update.Windows 10 April 2018 UpdateWindows 10 Fall Creators Update (October 2018)To read this article in full, please click here(Insider Story)",https://www.computerworld.com/article/3210805/microsoft-windows/windows-10-october-2018-update-key-enterprise-features.html#tk.rss_all,0,computerworld,"xml,frontend,java,backend,typescript,angular",NULL,2018-11-13
Review: Windows 10 October 2018 Update delivers modest but useful tweaks," The big twice-a-year Windows 10 update is here ... except this time, it’s not so big. The Windows 10 October 2018 Update, a.k.a. version 1809, is perhaps the least impressive of the major updates since Windows 10 was introduced. It sports no big, new capabilities like Timeline, the flagship feature of the Windows 10 April 2018 Update. Still, it’s got some good sleeper features, a hidden gem or two, a few bombs, and a host of useful if not groundbreaking features.The release will be rolled out to Windows 10 users in phases, so it might be some time before you see it arrive on your computer. In fact, the rollout was scheduled to begin on October 9, but after some users who upgraded to version 1809 reported problems including the loss of all files in their Documents, Pictures, Music, and Videos folders, Microsoft paused the rollout. After more than a month's delay, the company finally resumed pushing out the release on November 13. If you want to delay the update even longer and then install it on your own schedule, here's how to block it temporarily.To read this article in full, please click here",https://www.computerworld.com/article/3307851/microsoft-windows/review-windows-10-october-2018-update-delivers-modest-but-useful-tweaks.html#tk.rss_all,0,computerworld,,NULL,2018-11-13
Get Over 45 Hours Of Immersive Ethical Hacking Training For $25 (90% Off)," Your private data can reveal a lot about you, such as bank information, spending habits, and even the websites you frequent. This makes large companies like Facebook and Yahoo prime targets for data breaches because of their vast library of user data. Nowadays, it’s more important than ever for companies to remain vigilant against hackers, lest their customers’ privacy and trust be lost.To defend against such threats, companies hire security professionals who know how to identify and exploit vulnerabilities in security systems. These “ethical hackers” employ the same methods malicious hackers do, but they also patch and report these vulnerabilities to their employers to prevent future intrusions. With data breaches on the rise, the demand for ethical hackers has increased, making this career path both stable and profitable. If you’re interested in learning how to hack security systems (legally, of course) then this $39 Ethical Hacking A to Z Training Bundle is for you.To read this article in full, please click here",https://www.computerworld.com/article/3320620/security/get-over-45-hours-of-immersive-ethical-hacking-training-for-25-90-off.html#tk.rss_all,0,computerworld,"python,bootstrap,javascript,frontend,swift",NULL,2018-11-13
"Microsoft takes second swing at Windows 10 1809, re-issues troubled upgrade"," After a 38-day delay, Microsoft today re-released its fall operating system feature upgrade, the Windows 10 October 2018 Update.The more-than-a-month delay had no precedent in Windows 10, something Microsoft acknowledged. And it lasted significantly longer than instances in earlier editions when updates, security fixes for the most part, had to be pulled and then later re-released.[ Further reading: How to handle Windows 10 updates ] ""Based on (telemetry) data, today we are beginning the re-release of the October Update by making it available via media and to advanced users who seek to manually check for updates,"" John Cable, director of program management in the Windows servicing and delivery team, wrote in a post to a company blog.To read this article in full, please click here",https://www.computerworld.com/article/3321136/microsoft-windows/microsoft-takes-second-swing-at-windows-10-1809-re-issues-troubled-upgrade.html#tk.rss_all,0,computerworld,java,NULL,2018-11-13
How to check the condition of your Mac’s battery," A friend of mine was considering purchasing an old(ish) MacBook Pro and wanted to check the battery life as they arranged the deal.That’s when I thought it might be worth sharing this little tip, given lots of people will be selling Macs to get hold of a new MacBook Air.Battery cycles for battery health That’s when I remembered this little-known, but really quite useful (and mercifully short), Mac tip that helps you get some kind of insight into your Mac’s battery health.[ Related: Apple's place is in the enterprise ] The batteries used inside Macs are built to handle a number of battery cycles.To read this article in full, please click here",https://www.computerworld.com/article/3321001/apple-mac/how-to-check-the-condition-of-your-mac-s-battery.html#tk.rss_all,0,computerworld,,NULL,2018-11-13
Windows 10: A guide to the updates," The launch of a big Windows 10 update like the October 2018 Update isn’t the end of a process — it’s really just the beginning. As soon as a major update is released, Microsoft quickly gets to work on improving it by fixing bugs, releasing security patches, and occasionally adding new features.Here we’ve summarized what you need to know about every Windows 10 update being released to the public. First come updates to the currently shipping version of Windows 10 — version 1809, known as the October 2018 Update — with the most recent updates on top. (Note that the October 2018 Update is on a phased rollout, so you may not have received it yet.) Below that are updates to version 1803, known as the April 2018 Update; 1709, known as the Fall Creators Update; and finally updates to version 1703, known as the Creators Update. For each build, we’ve included the date of its initial release and a link to Microsoft’s announcement about it.To read this article in full, please click here",https://www.computerworld.com/article/3199077/microsoft-windows/windows-10-a-guide-to-the-updates.html#tk.rss_all,0,computerworld,,NULL,2018-11-13
Windows 10 version 1809 re-released. Pro tip: Wait.," It’s been an interesting morning, in an ancient Chinese curse kind of way. First we saw an official announcement that Windows Server 2019 was released. (Server 2019 is based on the Win10 1809 platform.) Only one problem: The bits weren’t available as advertised, and then the page was pulled.[ Related: Windows 10 October 2018 Update: Key enterprise features ] Then came an announcement that Microsoft is re-releasing Win10 version 1809 today. The bits finally arrived, sooner or later, accompanied by a lengthy explanation from Microsoft Vice President Michael Fortin of the burdens Microsoft encounters servicing a $10-billion-plus user base:To read this article in full, please click here",https://www.computerworld.com/article/3320938/microsoft-windows/windows-10-version-1809-re-released-pro-tip-wait.html#tk.rss_all,0,computerworld,,NULL,2018-11-13
"Get 90% Off Your First Year of RemotePC, Up To 50 Computers for $6.95"," iDrive has activated a significant discount on their Remote access software RemotePC in these days leading into Black Friday. RemotePC by iDrive is a full-featured remote access solution that lets you connect to your work, home or office computer securely from anywhere, and from any iOS or Android device. Right now, their 50 computer package is 90% off or just $6.95 for your 1st year. If you've been thinking about remote access solutions, now is a good time to consider RemotePC. Learn more about it here.To read this article in full, please click here",https://www.computerworld.com/article/3307866/remote-access/get-90-off-your-first-year-of-remotepc-up-to-50-computers-for-695.html#tk.rss_all,0,computerworld,,NULL,2018-11-13
Pixel 3 vs. Pixel 2: Why smaller bezels aren't that big a deal," When you hear people talk about Google's Pixel 3 and whether it's worth the upgrade over the previous-gen Pixel 2, one consistent theme always comes up: If there's any reason to make the upgrade, it's for the smaller bezels and bigger screen.What folks are getting at, y'see, is the fact that the Pixel 3 packs more active display space into the same basic footprint as last year's model — which, on the surface, sure seems like a good thing. And it is a good thing! I mean, why wouldn't you want more screen space in the same sized phone, right?To read this article in full, please click here",https://www.computerworld.com/article/3320576/android/pixel-3-vs-pixel-2.html#tk.rss_all,0,computerworld,,NULL,2018-11-13
"HP Offering $330 off Pavilion 15z 15.6"" Touchscreen Laptop Right Now ($370)"," You don't have to wait for Black Friday. Deals have started to drop early, but you have to know where to look. HP has activated a whopping $330 discount on its Pavilion 15z 15.6"" Touchscreen Laptop, which puts it at just $369.99 with Free Shipping, but the deal ends Wednesday 11/14. This laptop comes with Windows 10 Home 64, the AMD Ryzen™ 3 processor, AMD Radeon™ Vega 3 Graphics, 8 GB memory, 1 TB HDD storage, and a 15.6"" diagonal HD touch display. See the full spec, customize, and/or buy it here while the deal is active. If you haven't seen it yet, HP has posted a Black Friday deals page right here that includes a few other early deals you may be interested in.To read this article in full, please click here",https://www.computerworld.com/article/3320862/hardware/hp-offering-330-off-pavilion-15z-156-touchscreen-laptop-right-now-370.html#tk.rss_all,0,computerworld,,NULL,2018-11-13
The Linux desktop: With great success comes great failure," Stop me if you’ve heard this one before: &lt;yyyy&gt; will be the year of the Linux desktop. Even in Linux circles this is greeted with eye-rolling. Here’s the funny thing, though: Linux long ago won the hearts and minds of end users, even while the Linux desktop continues to spin its wheels.How can that be?The paradox is easily explained. But as for Linux’s failure to capture desktop hearts and minds, that’s a complicated story. I’ll lay it out for you.First, the paradox: According to the latest Annenberg Surveying the Digital Future report, the average American now spends 24 hours a week online. Meanwhile, Kleiner Perkins partner Mary Meeker’s 2018 Internet Trends Report shows the average adult in 2017 spending 5.9 hours a day watching or listening to digital media.To read this article in full, please click here",https://www.computerworld.com/article/3320859/linux/the-linux-desktop-with-great-success-comes-great-failure.html#tk.rss_all,0,computerworld,python,NULL,2018-11-13
FAQ: Windows 10 LTSB explained," Windows 10 powered to its third anniversary this year, but one branch, identified by the initials L-T-S-B, remained an enigma to most corporate users.LTSB, which stands for ""Long-term Servicing Branch,"" was among the pillars of Windows 10 in the months leading up to, and for months after, the mid-2015 roll-out of the operating system. For a time, it seemed that it had a shot at becoming the Windows 10 for enterprise because it was seen as a calm port in a storm of radical change.[ Related: Fix Windows 10 problems with these free Microsoft tools ] That hasn't happened, in part because Microsoft has steered customers away from LTSB.To read this article in full, please click here",https://www.computerworld.com/article/3250464/microsoft-windows/faq-windows-10-ltsb-explained.html#tk.rss_all,0,computerworld,,NULL,2018-11-13
"Blockchain 2019: How crypto will convert cash, property into digital assets"," In 2019, the most innovative work involving distributed ledger technology (DLT) – blockchain – will focus on the tokenization of assets, or the ability to represent digital or physical assets and fiat currencies as tokens that can be sold or traded on a network.DLT has the ability to take anything, from a piece of artwork to gems and real estate, and represent them as cryptographically hashed assets on a peer-to-peer, open electronic network that has no central authority, such as a bank, governing their trade or sale.[ Related: The top 5 problems with blockchain ] Representing digital or physical assets as tokens on a DLT-based network enables participants to reinvent processes and develop new business models – uncharted territory from both a business and technology perspective, according to a new report from Forrester Research.To read this article in full, please click here",https://www.computerworld.com/article/3319744/blockchain/blockchain-2019-how-crypto-will-convert-cash-property-into-digital-assets.html#tk.rss_all,0,computerworld,,NULL,2018-11-13
Doing the math," Pilot fish is interviewing for an IT job when he learns that many of the company's top technical staffers are actually consultants.""These were primary technical staff, the subject matter experts,"" says fish. ""Most companies prefer to staff those types of positions with permanent employees due to their importance to the organization with the knowledge they have, so I asked about that.""I was told that those consultants had been employees there at one time, and chose to switch over to hourly employees.""This seemed strange to me, being fairly early in my career and not having a deep breadth of knowledge of how organizations work. They seemed to have decent benefits -- why would anyone want to give them up?To read this article in full, please click here",https://www.computerworld.com/article/3320856/it-careers/doing-the-math.html#tk.rss_all,0,computerworld,,NULL,2018-11-13
Windows 10 rollout snafu: Day 37," Thirty-seven days after Microsoft withdrew the Windows 10 October 2018 Update from all distribution, the Redmond, Wash. company has yet to restart delivery.The delay has no precedent in Windows 10 and has gone on significantly longer than instances in prior editions when updates, most of them security fixes, had to be pulled and then later re-released.[ Related: Windows 10 October 2018 Update: Key enterprise features ] Microsoft debuted the fall feature upgrade, also known as 1809 in the firm's yymm format, on Oct. 2. Four days later - Oct. 6 - it retracted the release by yanking it from the Windows Update service and manual download sites, and warning users who had grabbed it to toss the disk image in the trash. The reason: Some users - Microsoft said 1/100th of 1% - reported that the upgrade deleted all files in several folders, including the important Documents and Photos directories.To read this article in full, please click here",https://www.computerworld.com/article/3319739/microsoft-windows/windows-10-rollout-snafu-day-37.html#tk.rss_all,0,computerworld,"xml,frontend,java,backend,typescript,angular",NULL,2018-11-12
IDG Contributor Network: HP design innovation on PCs and printers will spread to homes and offices," [Disclosure: HP is a client of the author.]My first portable PC (you’d never call it a laptop), was made by Panasonic. It cost something like $7K in today’s dollars (allowing for inflation), weighed 35 pounds and included a thermal printer. I also work from home so unlike my office-oriented peers, part of what I think about when I equip or update my home office is the printer — even though it’s no longer integrated with my laptop (thankfully). For much of my career, laptop design has largely been driven by one of two factors. Corporate buyers who had no taste (and resulted in a long period of time when hardware design could best be described as butt-ugly), or Apple, who tended to put form over function resulting in pretty but often unreliable or fragile products. (My first Apple laptop fell off a chair onto carpet and broke both hinges on its screen, something I’d never seen happen before or since.) To read this article in full, please click here",https://www.computerworld.com/article/3320477/hp/hp-design-innovation-on-pcs-and-printers-will-spread-to-homes-and-offices.html#tk.rss_all,0,computerworld,,NULL,2018-11-12
"HTC Vive unveils standalone VR headset, collaboration app for the enterprise"," HTC Vive has launched a handful of enterprise-focused products, with a new standalone “mobile” VR headset, developer tools and a collaboration app that promises to connect remote employees.The Taiwanese company last week announced that the Vive Focus head-mounted display will now ship in the U.S., following a launch in China earlier this year.[ Related: 7 Trello alternatives for visual task management ] The Vive Focus is a standalone headset that functions without a PC connection, unlike the company's tethered Vive Pro device. It features similar specs to the “professional-grade” Vive Pro, with 2880-x-1600-pixel resolution. Unlike other mobile VR headsets, the Vive Focus does not require a smartphone be inserted; it relies on embedded hardware – powered by Qualcomm's Snapdragon 835 chip – supports a 110-degree field of view and lasts up to three hours on a single charge.To read this article in full, please click here",https://www.computerworld.com/article/3319749/collaboration/htc-vive-touts-standalone-vr-headset-collaboration-app-for-the-enterprise.html#tk.rss_all,0,computerworld,"xml,frontend,java,backend,typescript,angular",NULL,2018-11-12
Time to block Windows Automatic Update — with a new twist for Win10 Pro," Rumors swirling all over the blogosphere have Microsoft re-releasing the ill-fated Win10 version 1809 on Patch Tuesday this month. Personally, given the dearth of worthwhile features in 1809 and the painful first release last month, I’d rather that they just wait a week or a month or six, until it’s fully baked, but that probably won’t happen.Better still, I wish they’d wait a year or two, roll in some new features worthy of a full reinstall, and then unleash something new and worthwhile. If wishes were horses ...To read this article in full, please click here",https://www.computerworld.com/article/3320476/microsoft-windows/time-to-block-windows-automatic-update-with-a-new-twist-for-win10-pro.html#tk.rss_all,0,computerworld,,NULL,2018-11-12
"IDG Contributor Network: At CES 2019, 5G wireless plays an increasing role"," CES 2019 is coming to Las Vegas in early January and every year around this time, my email goes nuts. As a high-profile wireless analyst, I typically get more email every day than I have time to read, from a wide variety of competitors who want me to learn about them, write about them and talk about them. This time of year, it doubles. So, what’s coming in 2019?As I have to explain to each company who wants to get on my radar, it’s not that easy. Over the last thirty years I have built a strong reputation as an independent wireless industry analyst, so I must take my time and learn about them before I consider talking or writing about them.Wireless plays an increasingly larger role at the Consumer Electronics Show I’ve been attending the Consumer Electronics show for the last several decades and have watched it change dramatically and grow over time. When I attend, I meet with countless company executives either at their booth or in their hotel rooms where they give me a demonstration and briefing.To read this article in full, please click here",https://www.computerworld.com/article/3320457/mobile-wireless/at-ces-2019-5g-wireless-plays-an-increasing-role.html#tk.rss_all,0,computerworld,,NULL,2018-11-12
Microsoft's strategy: Force enterprises to buy every traditional Office upgrade,"Microsoft has figured out how to stymie enterprises that cut costs by licensing Office the old-fashioned way, a pair of researchers said.To read this article in full, please click here(Insider Story)",https://www.computerworld.com/article/3319702/office-software/microsofts-strategy-force-enterprises-to-buy-every-traditional-office-upgrade.html#tk.rss_all,0,computerworld,,NULL,2018-11-12
Maybe he started out in APL and just never got over it?," This pilot fish starts his mainframe programming career at a state agency, but soon moves on to a job at a company in the record industry -- which turns out to be much more, um, challenging.""The environment is totally different,"" fish says. ""I'm responsible for supporting several high-profile production and revenue applications.""All is well until there's a coding update request, and my manager wants to review the code before it's even tested, much less implemented.""I have the compiled output ready to review with my manager, but he takes it away to review alone so he's not interrupted.""Other members of my group are laughing when I return to my desk, but they don't explain why.To read this article in full, please click here",https://www.computerworld.com/article/3319745/application-development/maybe-he-started-out-in-apl-and-just-never-got-over-it.html#tk.rss_all,0,computerworld,,NULL,2018-11-12
