title,content,url,cnt,source,keyword,image,createdAt,priority
CSS Audits: Taking Stock of Your Code,"Most people aren’t excited at the prospect of auditing code, but it’s become one of my favorite types of projects. A CSS audit is really detective work. You start with a site’s code and dig deeper: yo...",https://alistapart.com/article/css-audits-taking-stock-of-your-code,0,alistapart,"javascript,jquery,bootstrap,frontend,html,react",,2014-09-16,0
Client Education and Post-Launch Success,"What our clients do with their websites is just as important as the websites themselves. We may pride ourselves on building a great product, but it’s ultimately up to the client to see it succeed or f...",https://alistapart.com/article/client-education-and-post-launch-success,0,alistapart,,,2014-09-16,0
Work Life Imbalance,"A note from the editors: We’re excited to welcome new columnist Rian van der Merwe today.  A former denizen of Silicon Valley (among other fascinating places), Rian thinks a lot about how work and lif...",https://alistapart.com/column/work-life-imbalance,0,alistapart,,,2014-09-11,0
Awkward Cousins,"As an industry, we’re historically terrible at drawing lines between things. We try to segment devices based on screen size, but that doesn’t take into account hardware functionality, form factor, and...",https://alistapart.com/blog/post/awkward-cousins,0,alistapart,,,2014-09-08,0
Watch: A New Documentary About Jeffrey Zeldman,It’s a philosophy that’s always guided us at A List Apart: that we all learn more—and are more successful—when we share what we know with anyone who wants to listen. And it comes straight from our pub...,https://alistapart.com/blog/post/jeffrey-zeldman-documentary,0,alistapart,,,2014-09-04,0
Git: The Safety Net for Your Projects,"I remember January 10, 2010, rather well: it was the day we lost a project’s complete history. We were using Subversion as our version control system, which kept the project’s history in a central rep...",https://alistapart.com/article/git-the-safety-net-for-your-projects,0,alistapart,"swift,frontend,typescript,rust",https://alistapart.com/d/402/branch-listing.jpg,2014-09-02,0
Running Code Reviews with Confidence,"Growing up, I learned there were two kinds of reviews I could seek out from my parents. One parent gave reviews in the form of a shower of praise. The other parent, the one with a degree from the Roya...",https://alistapart.com/article/running-code-reviews-with-confidence,0,alistapart,,https://alistapart.com/d/402/gitk.jpg,2014-09-02,0
Getting to the Action,"Freelancers and self-employed business owners can choose from a huge number of conferences to attend in any given year. There are hundreds of industry podcasts, a constant stream of published books, a...",https://alistapart.com/column/getting-to-the-action,0,alistapart,"blockchain,bitcoin",,2014-08-28,0
10 Years Ago in ALA: Pocket Sized Design,"The web doesn’t do “age” especially well. Any blog post or design article more than a few years old gets a raised eyebrow—heck, most people I meet haven’t read John Allsopp’s “A Dao of Web Design” or ...",https://alistapart.com/blog/post/10-years-ago-in-ala-pocket-sized-design,0,alistapart,,,2014-08-25,0
Dependence Day: The Power and Peril of Third-Party Solutions,"“Why don’t we just use this plugin?” That’s a question I started hearing a lot in the heady days of the 2000s, when open-source CMSes were becoming really popular. We asked it optimistically, full of ...",https://alistapart.com/article/dependence-day-the-power-and-peril-of-third-party-solutions,0,alistapart,"frontend,css",,2014-08-19,0
One Step Ahead: Improving Performance with Prebrowsing,"We all want our websites to be fast. We optimize images, create CSS sprites, use CDNs, cache aggressively, and gzip and minimize static content. We use every trick in the book. Want the best way to st...",https://alistapart.com/article/one-step-ahead-improving-performance-with-prebrowsing,0,alistapart,,https://alistapart.com/d/401/fig1-o.jpg,2014-08-19,0
My Favorite Kevin Cornell,"After 200 issues—yes, two hundred—Kevin Cornell is retiring from his post as A List Apart’s staff illustrator. Tomorrow’s issue will be the last one featuring new illustrations from him.Sob.For years ...",https://alistapart.com/blog/post/my-favorite-kevin-cornell,0,alistapart,,https://alistapart.com//alistapart.com/d/thedisciplineofcontentstrategy/discipline-content-strategy.jpg,2014-08-18,0
Valediction,"When I first met Kevin Cornell in the early 2000s, he was employing his illustration talent mainly to draw caricatures of his fellow designers at a small Philadelphia design studio. Even in that rough...",https://alistapart.com/blog/post/valediction,0,alistapart,,,2014-08-18,0
"Measure Twice, Cut Once","Not too long ago, I had a few rough days in support of a client project. The client had a big content release, complete with a media embargo and the like. I woke up on the day of the launch, and thing...",https://alistapart.com/blog/post/measure-twice-cut-once,0,alistapart,,https://alistapart.com//alistapart.com/d/misc-images/Blog_images/crash.png,2014-08-15,0
How We Read,"A note from the editors: We’re pleased to share an excerpt from Chapter 1 of Jason Santa Maria’s new book, On Web Typography, available now from A Book Apart.I want you to think about what you’re doin...",https://alistapart.com/article/how-we-read,0,alistapart,,https://alistapart.com/d/400/OWT-fig1-1.png,2014-08-05,0
The Most Dangerous Word In Software Development,“Just put it up on a server somewhere.”“Just add a favorite button to the right side of the item.”“Just add [insert complex option here] to the settings screen.”Usage of the word “just” points to a lo...,https://alistapart.com/blog/post/the-most-dangerous-word-in-software-development,0,alistapart,"frontend,react,python",,2014-07-30,0
"Gardens, Not Graves","The stream—that great glut of ideas, opinions, updates, and ephemera that pours through us every day—is the dominant way we organize content. It makes sense; the stream’s popularity springs from the d...",https://alistapart.com/article/gardens-not-graves,0,alistapart,,,2014-07-29,0
Radio-Controlled Web Design,"Interactive user interfaces are a necessity in our responsive world. Smaller screens constrain the amount of content that can be displayed at any given time, so we need techniques to keep navigation a...",https://alistapart.com/article/radio-controlled-web-design,0,alistapart,"webpack,javascript,jquery,css,frontend,html,react",,2014-07-29,0
Being Profitable,"This article is part one of a series. Read  part two,  Pricing the Web part three,  The Art of Creating Accurate Estimates part four,  Balancing the Scale When I recently read Geoff Dimasi’s excellent...",https://alistapart.com/column/being-profitable,0,alistapart,,,2014-07-24,0
Ten CSS One-Liners to Replace Native Apps,"Håkon Wium Lie is the father of CSS, the CTO of Opera, and a pioneer advocate for web standards. Earlier this year, we published his blog post, “CSS Regions Considered Harmful.” When Håkon speaks, whe...",https://alistapart.com/blog/post/ten-css-one-liners-to-replace-native-apps,0,alistapart,"javascript,jquery,bootstrap,frontend,html,react",https://alistapart.com//alistapart.com/d/misc-images/Blog_images/CSS_Figures/koster.jpg,2014-07-23,0
I Don’t Like It,"“I don’t like it”—The most dreaded of all design feedback from your client/boss/co-worker. This isn’t so much a matter of your ego being damaged, it’s just not useful or constructive criticism.In orde...",https://alistapart.com/column/i-dont-like-it,0,alistapart,,,2014-07-17,0
Kids 4–6: “The Muddy Middle”,"A note from the editors: We’re pleased to share an excerpt from Deb Gelman’s new book, Design for Kids, available now from Rosenfeld Media. ALA readers can save 20 percent with the code DFKALA. I call...",https://alistapart.com/article/kids-4-6-the-muddy-middle,0,alistapart,,https://alistapart.com/d/398/fig05.01.jpeg,2014-07-15,0
Longform Content with Craft Matrix,"Jason Santa Maria recently shared some thoughts about pacing content, and my developer brain couldn’t help but think about how I’d go about building the examples he talked about.The one fool-proof way...",https://alistapart.com/blog/post/longform-content-with-craft-matrix,0,alistapart,"matlab,javascript,python,jquery,frontend,html,php",https://alistapart.com//alistapart.com/d/misc-images/Blog_images/matrix-config.jpg,2014-07-09,0
In Pursuit of Facebook Happiness,"The outrage being directed at Facebook right now centers on its experiment in manipulating the emotions of 689,003 users in 2012.Regardless of where you stand on the issue, there’s no denying the phan...",https://alistapart.com/column/in-pursuit-of-facebook-happiness,0,alistapart,"frontend,react,android,php",https://alistapart.com/d/Column-Nishant/yoshi_happy.jpeg,2014-07-03,0
Structuring a New Collaborative Culture,"When I was a junior designer, my creative director asked me to design a mascot with the rather uninspiring instruction to reorder the shapes of the famous 2012 Olympics logo. Having little choice but ...",https://alistapart.com/article/structuring-a-new-collaborative-culture,0,alistapart,,,2014-07-01,0
Persuasion: Applying the Elaboration Likelihood Model to Design,"Persuasion is part of every aspect of our lives. Politicians want our vote, businesses want us to buy their products, and people want us to like them. Even altruistic nonprofits want us to change our ...",https://alistapart.com/article/persuasion-applying-the-elaboration-likelihood-model-to-design,0,alistapart,,https://alistapart.com/d/397/figure1.png,2014-07-01,0
Ten Years Ago in ALA: Dynamic Text Replacement,"Ten years ago this month, A List Apart published Stewart Rosenberger’s “Dynamic Text Replacement.” Stewart lamented text styling as a “dull headache of web design” with “only a handful of fonts that a...",https://alistapart.com/blog/post/ten-years-ago-in-ala-dynamic-text-replacement,0,alistapart,"javascript,python,css,frontend,html,php,ruby",,2014-06-27,0
The Doctor Is In,"A note from the editors: Way back in the early days of web design—back before, even, A List Apart—there was Zeldman.com, where thousands of us spent hour after hour soaking up every bit of web design ...",https://alistapart.com/column/doctor-is-in,0,alistapart,"javascript,jquery,css,frontend,animation,react",https://alistapart.com/d/misc-images/Ask_Dr_Web.gif,2014-06-26,0
Lessons Learned by Being the Client,"I ran a web development consultancy from mid-2001 through to early 2013. By 2006, the company I had started alone was busy enough for my husband, Drew McLellan, to join the business full time. The vas...",https://alistapart.com/column/lessons-learned-by-being-the-client,0,alistapart,,,2014-06-20,0
Apple and Responsive Design,"Apple has always had a funny relationship with responsive design. They’ve only sparingly used media queries to make minor visual tweaks on important pages, like their current homepage.Though a “handcr...",https://alistapart.com/blog/post/apple-and-responsive-design,0,alistapart,,,2014-06-11,0
Testing Responsive Images,"At long last, the native picture element isn’t just coming: it’s here. The picture element has landed in Canary—Google’s “beta” channel for upcoming Chrome releases—and we can try it out for ourselves...",https://alistapart.com/blog/post/testing-responsive-images,0,alistapart,,,2014-06-04,0
Prototyping Your Workflow,"Last year the digital agency I work for, Bluecadet, started a website redesign project for The Franklin Institute—a renowned Philadelphia science museum undergoing the largest expansion in its history...",https://alistapart.com/article/prototyping-your-workflow,0,alistapart,"webpack,angular,javascript,python,docker,css,frontend",,2014-06-03,0
Living up to Your (Business) Ideals,"I believe that most people are good. Most people really want to live up to their ideals. So why do companies fall short on living up to their missions, credos, mantras, or ideals? Want the best way to...",https://alistapart.com/article/living-up-to-your-business-ideals,0,alistapart,,,2014-06-03,0
On Styled Form Elements,"For almost 20 years, we’ve had the same input types and form elements we still use today: text fields and areas, password fields, select dropdowns, radio buttons, checkboxes, file fields, hidden field...",https://alistapart.com/blog/post/on-styled-form-elements,0,alistapart,,https://alistapart.com//alistapart.com/d/misc-images/apple-select.jpg,2014-05-30,0
We Have Work to Do: #yesallwomen and the Web,"Last week, I plucked an article from our submission inbox. It was about getting stuck in the “friendzone,” and likened women not wanting to date men to both the Holocaust and terrorism.It was obviousl...",https://alistapart.com/blog/post/work-to-do-yesallwomen,0,alistapart,"java,javascript,android,spring,sql,backend,database,jsp",,2014-05-29,0
Ten Years Ago in ALA: Art Direction and Drop Shadows,Writing for web designers is a tricky blend of trying to predict and shape the near-future while keeping your feet firmly grounded in the practical concerns of the here-and-now. Ten years ago this mon...,https://alistapart.com/blog/post/ten-years-ago-in-ala-art-direction-and-drop-shadows,0,alistapart,"frontend,css,jquery,javascript",,2014-05-20,0
Global Accessibility Awareness Day: Getting the Word Out,"Today is Global Accessibility Awareness Day. To mark the day and promote the goal of the day, groups of developers and designers interested in accessibility offer webinars, presentations, and networki...",https://alistapart.com/blog/post/global-accessibility-awareness-day-getting-the-word-out,0,alistapart,python,,2014-05-15,0
Design Tools for Today’s Web,"Even though I learned about designing for the web in what most would consider the modern era, I still learned (what I would consider) the old way of doing things. No, I’ve never made a table-based sit...",https://alistapart.com/blog/post/design-tools-for-todays-web,0,alistapart,,https://alistapart.com//alistapart.com/d/misc-images/sketch-export-panel.png,2014-05-14,0
Accessibility: The Missing Ingredient,"Once upon a time, I treated web accessibility as something of an extra. Sure, my images had alt attributes. Yes, my anchors contained titles. I honored 508 compliance, too, but it was usually the last...",https://alistapart.com/article/accessibility-the-missing-ingredient,0,alistapart,,https://alistapart.com//alistapart.com/d/395/accessibility-the-missing-ingredient/images/robot_shopper_cart_closed.png,2014-05-13,0
Can Email Be Responsive?,"Love it or hate it, there’s no denying the popularity of HTML emails. And, like the web before it, the inbox has officially gone mobile—with over 50 percent of email opens occurring on mobile devices....",https://alistapart.com/article/can-email-be-responsive,0,alistapart,"javascript,jquery,css,bootstrap,frontend,react",https://alistapart.com//alistapart.com/d/395/can-email-be-responsive/can-email-be-responsive-1.png,2014-05-13,0
Look at the Big Picture,"I dread the inevitable moment during every complex responsive project when someone raises the question, What should we do about images? Lots of the things we do on the web are hard, but I reserve a sp...",https://alistapart.com/column/look-at-the-big-picture,0,alistapart,,,2014-05-08,0
Moving Forward with CSS Shapes,"If you liked my CSS Shapes 101 article last week and are as excited about CSS Shapes as I am, then you may find a list of resources to dig deeper into CSS Shapes useful. In this post, I’m going to sha...",https://alistapart.com/blog/post/moving-forward-with-css-shapes,0,alistapart,"javascript,jquery,bootstrap,frontend,html,react",,2014-05-05,0
CSS Shapes 101,"Rectangles inside other rectangles: this is what our webpages have always been made of. We’ve long tried to break free from their restrictions by using CSS to create geometric shapes, but those shapes...",https://alistapart.com/article/css-shapes-101,0,alistapart,"javascript,jquery,bootstrap,frontend,html,react",https://alistapart.com/d/394/shape-outside-example.jpg,2014-04-29,0
DRY-ing Out Your Sass Mixins,"One of the most powerful features of the CSS preprocessor Sass is the mixin, an abstraction of a common pattern into a semantic and reusable chunk. Think of taking the styles for a button and, instead...",https://alistapart.com/article/dry-ing-out-your-sass-mixins,0,alistapart,"scss,frontend,css",,2014-04-29,0
A Different Letter to a Junior Designer,"Editor’s note: Last week, Cennydd Bowles published his “Letter to a Junior Designer.” Today, Andrew Clarke offers a different perspective. To be honest, I envy you. I envy your energy and your enthusi...",https://alistapart.com/blog/post/a-different-letter-to-a-junior-designer,0,alistapart,,,2014-04-24,0
Responsive Design: The Picture Element Comes of Age,"Until now, Picturefill supported span-based HTML markup that mimicked a pattern we hoped would one day become a web standard: namely, the picture element and its associated features. Following the har...",https://alistapart.com/blog/post/responsive-design-the-picture-element-comes-of-age,0,alistapart,"frontend,css",,2014-04-21,0
Syntax Highlighting Outside Your Editor,"Whether you’re giving a talk, sharing work with your team, or presenting work to your clients, there comes a time when you’ll need to show code outside of a text editor. Copying and pasting code from ...",https://alistapart.com/blog/post/syntax-highlighting-outside-your-editor,0,alistapart,,https://alistapart.com//alistapart.com/d/misc-images/sublimehighlight.png,2014-04-21,0
The Death of the Web Design Agency?,"Others have gone as far to say that the very concept of a user experience-focused agency simply isn’t a long-term play, largely because of what the big folks are up to. Facebook and Google went on a d...",https://alistapart.com/blog/post/the-death-of-the-web-design-agency,0,alistapart,,,2014-04-17,0
Letter to a Junior Designer,"I admit it: you intimidate me. Your work is vivid and imaginative, far superior to my woeful scratchings at a similar age. The things I struggle to learn barely make you sweat. One day, you’ll be a be...",https://alistapart.com/column/letter-to-a-junior-designer,0,alistapart,,,2014-04-17,0
My Life with Email,"I’d like to take a moment to address something decidedly unsexy. We all do it. And it’s never pretty. You guessed it: I’m talking about email.No, I don’t mean responsive design approaches for email ne...",https://alistapart.com/column/my-life-with-email,0,alistapart,"android,php",,2014-04-10,0
Easy Color Contrast Testing,"We have plenty of considerations to design for when crafting websites. Web accessibility is not a new design consideration, but is still very important, no matter the size or speed of device we’re tes...",https://alistapart.com/blog/post/easy-color-contrast-testing,0,alistapart,,https://alistapart.com//alistapart.com/d/misc-images/ColorContrastStep1-slowed-lq.gif,2014-04-09,0
The Heartbleed Bug (or: You Should Consider SSL Unsafe for a While),"If you run a server that uses SSL and the OpenSSL library, you need to update it. If you regularly visit a site that uses SSL (and I can’t imagine you don’t), you should try to limit your visits today...",https://alistapart.com/blog/post/the-heartbleed-bug-or-you-should-consider-ssl-unsafe-for-a-while,0,alistapart,"mongodb,android,database,docker",,2014-04-08,0
Creating Style Guides,"Several years ago, I was working on a large, complex application. It was a bit of a legacy project: many different designers and front-end developers had come and gone, each appending a new portion to...",https://alistapart.com/article/creating-style-guides,0,alistapart,,https://alistapart.com/d/393/creating-style-guides/starbucks.png,2014-04-08,0
The Z-Axis: Designing for the Future,"For years we’ve thought about the web as a two-dimensional space filled with pages that sit side by side on a flat, infinite plane. But as the devices we design for take on an increasingly diverse arr...",https://alistapart.com/article/the-z-axis-designing-for-the-future,0,alistapart,,https://alistapart.com/d/393/the-z-axis-designing-for-the-future/layers.jpg,2014-04-08,0
Network Performance Testing,"It’s extremely likely that sometime in 2014, the number of internet users will pass 3 billion. Not surprisingly, the largest areas of growth are developing markets—predominantly Africa and the Asia-Pa...",https://alistapart.com/blog/post/network-performance-testing,0,alistapart,"android,python,java",,2014-04-07,0
Me and My Big Fat Ego,Designers are renowned for having egos. But we’re really not all big-headed prima donnas. It’s just that we can devote so much of our time and care to our work that it becomes entangled with our self-...,https://alistapart.com/column/me-and-my-big-fat-ego,0,alistapart,,,2014-04-03,0
Bringing Responsive Images to Browsers,"After almost three years in pursuit of a standardized solution to the problem of responsive images, the Responsive Images Community Group is excited to announce that the picture element is officially ...",https://alistapart.com/blog/post/bringing-responsive-images-to-browsers,0,alistapart,,,2014-04-01,0
Content-out Layout: the Resources,"The method I outlined in my recent article, “Content-out Layout,” is actually the culmination of quite a few different influences. If you’re interested in a deep dive, I have compiled this list of the...",https://alistapart.com/blog/post/content-out-layout-the-resources,0,alistapart,"frontend,css",,2014-03-31,0
Our Enclosed Space,"I speak fairly frequently at conferences, and I get to listen to a lot of web designers and developers giving their presentations at these events. I often have my laptop open on my knee to keep an eye...",https://alistapart.com/column/our-enclosed-space,0,alistapart,,,2014-03-27,0
People Skills for Web Workers,"The web touches everything an organization does—marketing to customer service, product development to branding, internal communications to recruitment. This is the era of cross-platform digital servic...",https://alistapart.com/article/people-skills-for-web-workers,0,alistapart,"frontend,docker,css,javascript",,2014-03-25,0
Content-out Layout,"Grids serve well to divide up a predefined canvas and guide how content fits onto a page, but when designing for the web’s fluid nature, we need something more… well, responsive. Enter ratios, which a...",https://alistapart.com/article/content-out-layout,0,alistapart,,https://alistapart.com/d/392/content-out-layout/Fig-1-even.jpg,2014-03-25,0
Save Your Eyes with f.lux,"I never thought I felt eye strain from looking at big, bright screens all day—I thought my young eyes were invincible. Then I started getting sharp headaches at the end of every day, and I realized I ...",https://alistapart.com/blog/post/save-your-eyes-with-flux,0,alistapart,,,2014-03-24,0
Inspiration,"“Where do you get your inspiration from?” It’s an odd question that designers ask each other. But it’s not asking what motivates us to do our work, or what makes us want to be designers in the first p...",https://alistapart.com/column/inspiration,0,alistapart,,https://alistapart.com/d/Inspiration-Kalbag/eyes-for-web.jpg,2014-03-20,0
A Q&A on the Picture Element,"The revival of the picture element—the responsive images proposal that has seen the most support from the developer community—is exciting news, but there are still some outstanding questions about how...",https://alistapart.com/blog/post/picture-element-qa,0,alistapart,,,2014-03-17,0
Ten Years Ago in A List Apart: CSS Sprites – Image Slicing’s Kiss of Death,"My fellow old-time web designers may remember the joys of image swapping via JavaScript. Here’s how we did it back in 1998 (don’t hate me because I’m beautiful): Even when some of us figured out, the ...",https://alistapart.com/blog/post/ten-years-ago-in-a-list-apart-css-sprites-image-slicings-kiss-of-death,0,alistapart,"java,javascript,android,jquery,bootstrap,frontend,html,react",,2014-03-14,0
Good Taste Doesn’t Matter,"A couple of days after Macklemore took home this year’s Grammy for Best Rap Album, Slate pop critic Jack Hamilton wrote a scathing reaction titled Don’t hate Macklemore because he’s white. Hate him be...",https://alistapart.com/column/good-taste-doesnt-matter,0,alistapart,,,2014-03-13,0
We’re Nothing Without You: The Web at 25,The World Wide Web celebrates its 25th birthday with a newly launched website commissioned by the World Wide Web Consortium (W3C) and designed and developed by A List Apart’s own creative director/des...,https://alistapart.com/blog/post/were-nothing-without-you-the-web-at-25,0,alistapart,"frontend,css",,2014-03-12,0
Using Embeddable Getty Images,"Last week, the world’s largest photo service, Getty Images, announced a new policy allowing their images to be embedded on websites for no charge. The images are embedded through an iframe which pulls...",https://alistapart.com/blog/post/using-embeddable-getty-images,0,alistapart,"java,javascript,android,spring,frontend",,2014-03-12,0
The Latest in Web Font Trends,"Ever since @font-face was introduced, our web font choices have grown tremendously each year. Web font trend data can help us make sense of all those new choices—and give insight into which typefaces ...",https://alistapart.com/blog/post/web-font-trends,0,alistapart,"javascript,jquery,css,frontend,react",,2014-03-10,0
