title,content,url,cnt,source,keyword,image,createdAt,priority
Braces to Pixels,"Doesn’t CSS seem like magic? Well, in this third installment of “URL to Interactive” we’ll look at the journey that your browser goes through to take your CSS from braces to pixels. As a bonus, we’ll ...",https://alistapart.com/article/braces-to-pixels,0,alistapart,,https://alistapart.com/d/braces-to-pixels/03_Braces_to_Pixels_2_696w.png,2018-11-15,0
Tags to DOM,"In our previous segment, “Server to Client,” we saw how a URL is requested from a server and learned all about the many conditions and caches that help optimize delivery of the associated resource. On...",https://alistapart.com/article/tags-to-dom,0,alistapart,,https://alistapart.com/d/tags-to-dom2/fig2.png,2018-11-01,0
From URL to Interactive,"Imagine, if you will, that you’re behind the wheel of a gorgeous 1957 Chevy Bel Air convertible, making your way across the desert on a wide open highway. The sun is setting, so you’ve got the top dow...",https://alistapart.com/article/from-url-to-interactive,0,alistapart,,,2018-10-25,0
Server to Client,"Before anything can happen in a browser, it must first know where to go. There are multiple ways to get somewhere: entering a URL in the address bar, clicking (or tapping) on a link on a page or in an...",https://alistapart.com/article/server-to-client,0,alistapart,"frontend,react,css,javascript",,2018-10-25,0
Writing for Designers,"A note from the editors: We’re pleased to share an excerpt from the Introduction of Scott Kubie’s Writing for Designers, from A Book Apart.Shit. The writing. We forgot about the writing. The thing, th...",https://alistapart.com/article/writing-for-designers-excerpt,0,alistapart,"frontend,ruby,javascript",https://alistapart.com/d/wfd/WFD001_-_workflow_planner_worksheet.jpg,2018-10-18,0
Designing for Cognitive Differences,"Inclusive design is designing to be inclusive of as many users as possible, considering all aspects of diversity in users. With increased understanding, compassionate discussions around how to design ...",https://alistapart.com/article/designing-for-cognitive-differences,0,alistapart,,,2018-10-16,0
The FAQ as Advice Column,"Dear A List Apart,I have a problem that may be harming my content strategy career. In my current position, no one likes FAQs … except for me. The question-and-answer format is satisfying and efficient...",https://alistapart.com/article/the-faq-as-advice-column,0,alistapart,,https://alistapart.com/d/faq-advice/Too-Much-Text.png,2018-10-11,0
The Psychology of Design,"There are a number of debates about which additional skills designers should learn. Should designers code, write, or understand business? These skills are incredibly valuable but perhaps not essential...",https://alistapart.com/article/psychology-of-design,0,alistapart,,,2018-10-05,0
Web Developer Representation in W3C,"During its annual general member meeting on October 19th, the Fronteers board will propose both to become a member of the World Wide Web Consortium (W3C) and to hire Rachel Andrew as our representativ...",https://alistapart.com/article/web-developer-representation-in-w3c,0,alistapart,,,2018-09-27,0
Responsive Images,"I come here not to bury img, but to praise it.Want the best way to store and serve images and videos? Try Cloudinary. Get your own free account.A Book Apart: Brief books for people who make websites.A...",https://alistapart.com/article/responsive-images,0,alistapart,,,2018-09-20,0
Breaking the Deadlock Between User Experience and Developer Experience,"In early 2013, less than 14% of all web traffic came from mobile devices; today, that number has grown to 53%. In other parts of the world the difference is even more staggering: in African countries,...",https://alistapart.com/article/breaking-the-deadlock-between-user-experience-and-developer-experience,0,alistapart,"android,ruby,java",https://alistapart.com/d/breaking-the-deadlock-between-user-experience-and-developer-experience/figure-1-1x.png,2018-09-13,0
Design with Difficult Data,"You’ve been asked to design a profile screen for a mobile or web app. It will need to include an avatar, a name, a job title, and a location. You fire up Sketch or Figma. Maybe you pull out your draft...",https://alistapart.com/article/design-with-difficult-data,0,alistapart,,https://alistapart.com/d/design-with-difficult-data/IntroExample--bad@2x.png,2018-09-06,0
Conversational Semantics,"As Alexa, Cortana, Siri, and even customer support chat bots become the norm, we have to start carefully considering not only how our content looks but how it could sound. We can—and should—use HTML a...",https://alistapart.com/article/conversational-semantics,0,alistapart,,,2018-08-30,0
Coding with Clarity: Part II,"As any developer who works with other developers can attest, if code is unclear, problems occur. In Part I of this series, I went over some principles to improve clarity in our code to prevent problem...",https://alistapart.com/article/coding-with-clarity-part-ii,0,alistapart,,,2018-08-23,0
Make Something Great: Become an Open Source Contributor,"My first contribution to Bootstrap was a tiny line of CSS. It was a no-brainer to merge, but the feeling of seeing that bit of code in the project’s codebase was unreal and addictive.Want the best way...",https://alistapart.com/article/make-something-great-become-an-open-source-contributor,0,alistapart,,,2018-08-16,0
What is Typesetting?,"A note from the editors: We’re pleased to share an excerpt from Chapter 1 of Tim Brown’s Flexible Typesetting, from A Book Apart.Typesetting is the most important part of typography, because most text...",https://alistapart.com/article/flexible-typesetting,0,alistapart,"javascript,python,frontend,react,ruby",https://alistapart.com/d/flexible-typesetting/1-1.png,2018-08-09,0
Fixing Variable Scope Issues with ECMAScript 6,"Variable scope has always been tricky in JavaScript, particularly when compared to more structured languages like C and Java. For years, there wasn’t much talk about it because we had few options for ...",https://alistapart.com/article/fixing-variable-scope-issues-with-ecmascript-6,0,alistapart,,,2018-08-02,0
Webmentions: Enabling Better Communication on the Internet,Over 1 million Webmentions will have been sent across the internet since the specification was made a full Recommendation by the W3C—the standards body that guides the direction of the web—in early Ja...,https://alistapart.com/article/webmentions-enabling-better-communication-on-the-internet,0,alistapart,,https://alistapart.com/d/webmentions-enabling-better-communication-on-the-internet/wiz-khalifa-tweet.png,2018-07-19,0
Order Out of Chaos: Patterns of Organization for Writing on the Job,"A few years ago, a former boss of mine emailed me out of the blue and asked for a resource that would help him and his colleagues organize information more effectively. Like a dutiful friend, I sent h...",https://alistapart.com/article/order-out-of-chaos-patterns-of-organization-for-writing-on-the-job,0,alistapart,,https://alistapart.com/d/order-out-of-chaos/fig1.png,2018-07-05,0
Your Emails (and Recipients) Deserve Better Context,Email communication is an integral part of the user experience for nearly every web application that requires a login. It’s also one of the first interactions the user has after signing up. Yet too of...,https://alistapart.com/article/your-emails-and-recipients-deserve-better-context,0,alistapart,,https://alistapart.com/d/your-emails-deserve-better/fig1.png,2018-06-28,0
Discovery on a Budget: Part III,"Sometimes we have the luxury of large budgets and deluxe research facilities, and sometimes we’ve got nothing but a research question and the determination to answer it. Throughout the “Discovery on a...",https://alistapart.com/article/discovery-on-a-budget-part-iii,0,alistapart,,,2018-06-21,0
The Problem with Patterns,"It started off as an honest problem with a brilliant solution. As the ways we use the web continue to grow and evolve, we, as its well-intentioned makers and stewards, needed something better than mak...",https://alistapart.com/article/problem-with-patterns,0,alistapart,,https://alistapart.com/d/problem-with-patterns/fig1.png,2018-06-14,0
Orchestrating Experiences,A note from the editors: It’s our pleasure to share this excerpt from Chapter 2 (“Pinning Down Touchpoints”) of Orchestrating Experiences: Collaborative Design for Complexity by Chris Risdon and Patri...,https://alistapart.com/article/orchestrating-experiences,0,alistapart,,https://alistapart.com/d/orchestrating-experiences/fig1.jpg,2018-06-07,0
The Cult of the Complex,"’Tis a gift to be simple. Increasingly, in our line of work, ’tis a rare gift indeed. Want the best way to store and serve images and videos? Try Cloudinary. Get your own free account.A Book Apart: Br...",https://alistapart.com/article/cult-of-the-complex,0,alistapart,,,2018-05-31,0
Onboarding: A College Student Discovers A List Apart,"What would you say if I told you I just read and analyzed over 350 articles from A List Apart in less than six weeks? “You’re crazy!” might have passed through your lips. In that case, what would you ...",https://alistapart.com/article/onboarding-a-college-student-discovers-a-list-apart,0,alistapart,,,2018-05-22,0
The Slow Death of Internet Explorer and the Future of Progressive Enhancement,"My first full-time developer job was at a small company. We didn’t have BrowserStack, so we cobbled together a makeshift device lab. Viewing a site I’d been making on a busted first-generation iPad wi...",https://alistapart.com/article/the-slow-death-of-internet-explorer-and-future-of-progressive-enhancement,0,alistapart,,https://alistapart.com/d/slow-death-of-ie/fig1.png,2018-05-15,0
So You Want to Write an Article?,"So you want to write an article. Maybe you’ve got a great way of organizing your CSS, or you’re a designer who has a method of communicating really well with developers, or you have some insight into ...",https://alistapart.com/article/so-you-want-to-write-an-article,0,alistapart,,,2018-05-10,0
We’re Looking for People Who Love to Write,"Here at A List Apart, we’re looking for new authors, and that means you. What should you write about? Glad you asked!Want the best way to store and serve images and videos? Try Cloudinary. Get your ow...",https://alistapart.com/article/were-looking-for-people-who-love-to-write,0,alistapart,,,2018-05-08,0
Priority Guides: A Content-First Alternative to Wireframes,"No matter your role, if you’ve ever been involved in a digital design project, chances are you’re familiar with wireframes. After all, they’re among the most popular and widely used tools when designi...",https://alistapart.com/article/priority-guides-a-content-first-alternative-to-wireframes,0,alistapart,"java,javascript,android,python,css,frontend",https://alistapart.com/d/priority-guides/wireframes.png,2018-05-03,0
The Illusion of Control in Web Design,We all want to build robust and engaging web experiences. We scrutinize every detail of an interaction. We spend hours getting the animation swing just right. We refactor our JavaScript to shave tiny ...,https://alistapart.com/article/the-illusion-of-control-in-web-design,0,alistapart,,,2018-04-26,0
Working with External User Researchers: Part II,"In the first installment of the Working with External User Researchers series, we explored the reasons why you might hire a user researcher on contract and helpful things to consider in choosing one. ...",https://alistapart.com/article/working-with-external-user-researchers-part-ii,0,alistapart,,,2018-04-17,0
Going Offline,"A note from the editors: We’re excited to share Chapter 1 of Going Offline by Jeremy Keith, available this month from A Book Apart.Businesses are built on the web. Without the web, Twitter couldn’t ex...",https://alistapart.com/article/going-offline,0,alistapart,"frontend,react,python,css",https://alistapart.com/d/going-offline/fig-1.1.png,2018-04-10,0
Planning for Everything,"A note from the editors: We’re pleased to share an excerpt from Chapter 7 (“Reflecting”) of Planning for Everything: The Design of Paths and Goals by Peter Morville, available now from Semantic Studio...",https://alistapart.com/article/planning-for-everything,0,alistapart,,https://alistapart.com/d/planning-for-everything/fig7-1.png,2018-04-03,0
Meeting Design,"A note from the editors: We’re pleased to share an excerpt from Chapter 2 (“The Design Constraint of All Meetings”) of Meeting Design: For Managers, Makers, and Everyone by Kevin Hoffman, available no...",https://alistapart.com/article/meeting-design,0,alistapart,,https://alistapart.com/d/meeting-design/02_01.jpg,2018-03-29,0
Designing for Research,"If you’ve spent enough time developing for the web, this piece of feedback has landed in your inbox since time immemorial:Want the best way to store and serve images and videos? Try Cloudinary. Get yo...",https://alistapart.com/article/designing-for-research,0,alistapart,,https://alistapart.com/d/designing-for-research/fig-01-v2-1x.png,2018-03-20,0
Conversational Design,"A note from the editors: We’re pleased to share an excerpt from Chapter 1 of Erika Hall’s new book, Conversational Design, available now from A Book Apart.Texting is how we talk now. We talk by tappin...",https://alistapart.com/article/conversational-design,0,alistapart,,https://alistapart.com/d/conversational-design/fig-11.png,2018-03-15,0
A DIY Web Accessibility Blueprint,"The summer of 2017 marked a monumental victory for the millions of Americans living with a disability. On June 13th, a Southern District of Florida Judge ruled that Winn-Dixie’s inaccessible website v...",https://alistapart.com/article/diy-web-accessibility-blueprint,0,alistapart,"webpack,javascript,android,docker,css,frontend,react",,2018-03-13,0
"We Write CSS Like We Did in the 90s, and Yes, It’s Silly","As web developers, we marvel at technology. We enjoy the many tools that help with our work: multipurpose editors, frameworks, libraries, polyfills and shims, content management systems, preprocessors...",https://alistapart.com/article/we-write-css-like-we-did-in-the-90s-and-yes-its-silly,0,alistapart,"javascript,jquery,css,bootstrap,frontend,html,react",,2018-03-06,0
Owning the Role of the Front-End Developer,"When I started working as a web developer in 2009, I spent most of my time crafting HTML/CSS layouts from design comps. My work was the final step of a linear process in which designers, clients, and ...",https://alistapart.com/article/owning-the-role-of-the-front-end-developer,0,alistapart,,,2018-02-27,0
Discovery on a Budget: Part II,"Welcome to the second installment of the “Discovery on a Budget” series, in which we explore how to conduct effective discovery research when there is no existing data to comb through, no stakeholders...",https://alistapart.com/article/discovery-on-a-budget-part-ii,0,alistapart,,https://alistapart.com/d/discovery-on-a-budget-2/fig1.png,2018-02-13,0
My Accessibility Journey: What I’ve Learned So Far,"Last year I gave a talk about CSS and accessibility at the stahlstadt.js meetup in Linz, Austria. Afterward, an attendee asked why I was interested in accessibility: Did I or someone in my life have a...",https://alistapart.com/article/my-accessibility-journey-what-ive-learned-so-far,0,alistapart,,,2018-02-06,0
Design Like a Teacher,"In 2014, the clinic where I served as head of communications and digital strategy switched to a new online patient portal, a change that was mandated by the electronic health record (EHR) system we us...",https://alistapart.com/article/design-like-a-teacher,0,alistapart,,,2018-02-01,0
"CSS: The Definitive Guide, 4th Edition","A note from the editors: We’re pleased to share an excerpt from Chapter 19 (“Filters, Blending, Clipping, and Masking”) of CSS: The Definitive Guide, 4th Edition by Eric Meyer and Estelle Weyl, availa...",https://alistapart.com/article/css-the-definitive-guide-4th-edition,0,alistapart,"javascript,jquery,bootstrap,frontend,html,react",https://alistapart.com/d/css-definitive-guide-4th-ed/css4_1906.png,2018-01-30,0
The King vs. Pawn Game of UI Design,"If you want to improve your UI design skills, have you tried looking at chess? I know it sounds contrived, but hear me out. I’m going to take a concept from chess and use it to build a toolkit of UI d...",https://alistapart.com/article/the-king-vs-pawn-game-of-ui-design,0,alistapart,,https://alistapart.com/d/king-vs-pawn/fig1.png,2018-01-23,0
Mental Illness in the Web Industry,"The picture of the tortured artist has endured for centuries: creative geniuses who struggle with their metaphorical demons and don’t relate to life the same way as most people. Today, we know some of...",https://alistapart.com/article/mental-illness-in-the-web-industry,0,alistapart,,,2018-01-18,0
Working with External User Researchers: Part I,"You’ve got an idea or perhaps some rough sketches, or you have a fully formed product nearing launch. Or maybe you’ve launched it already. Regardless of where you are in the product lifecycle, you kno...",https://alistapart.com/article/working-with-external-user-researchers-part-i,0,alistapart,,,2018-01-16,0
No More FAQs: Create Purposeful Information for a More Effective User Experience,It’s normal for your website users to have recurring questions and need quick access to specific information to complete … whatever it is they came looking for. Many companies still opt for the ubiqui...,https://alistapart.com/article/no-more-faqs-create-purposeful-information-for-a-more-effective-user-experi,0,alistapart,,,2018-01-11,0
Why Mutation Can Be Scary,"A note from the editors: This article contain sample lessons from Learn JavaScript, a course that helps you learn JavaScript to build real-world components from scratch.To mutate means to change in fo...",https://alistapart.com/article/why-mutation-can-be-scary,0,alistapart,,,2018-01-09,0
Discovery on a Budget: Part I,"If you crack open any design textbook, you’ll see some depiction of the design cycle: discover, ideate, create, evaluate, and repeat. Whenever we bring on a new client or start working on a new featur...",https://alistapart.com/article/discovery-on-a-budget-part-i,0,alistapart,,https://alistapart.com/d/discovery-on-a-budget-1/fig1.png,2018-01-04,0
My Grandfather’s Travel Logs and Other Repetitive Tasks,"My grandfather, James, was a meticulous recordkeeper. He kept handwritten journals detailing everything from his doctor visits to the daily fluctuations of stocks he owned. I only discovered this part...",https://alistapart.com/article/my-grandfathers-travel-logs-and-other-repetitive-tasks,0,alistapart,"frontend,python,vue,javascript",https://alistapart.com/d/my-grandfathers-travel-logs/fig1.jpg,2017-12-14,0
How the Sausage Gets Made: The Hidden Work of Content,I won an Emmy for keeping a website free of dick pics.Want the best way to store and serve images and videos? Try Cloudinary. Get your own free account.A Book Apart: Brief books for people who make we...,https://alistapart.com/article/the-hidden-work-of-content,0,alistapart,,https://alistapart.com/d/the-hidden-work-of-content/live-from-space-screen.jpg,2017-12-12,0
"The Best Request Is No Request, Revisited","Over the last decade, web performance optimization has been controlled by one indisputable guideline: the best request is no request. A very humble rule, easy to interpret. Every network call for a re...",https://alistapart.com/article/the-best-request-is-no-request-revisited,0,alistapart,"webpack,javascript,jquery,css,frontend,html,react",https://alistapart.com/d/the-best-request-is-no-request-revisited/figure-1.png,2017-11-28,0
Faux Grid Tracks,"A little while back, there was a question posted to css-discuss:Want the best way to store and serve images and videos? Try Cloudinary. Get your own free account.A Book Apart: Brief books for people w...",https://alistapart.com/article/faux-grid-tracks,0,alistapart,,https://alistapart.com/d/faux-grid-tracks/basic-layout.png,2017-11-21,0
Feedback That Gives Focus,I have harbored a lifelong dislike of feedback. I didn’t like it in sixth grade when a kid on the bus told me my brand new sneakers were “too bright.” And I didn’t like it when a senior executive hear...,https://alistapart.com/article/feedback-that-gives-focus,0,alistapart,,,2017-11-14,0
Planning for Accessibility,"A note from the editors: We’re pleased to share an excerpt from Chapter 3 (“Planning for Accessibility) of Laura Kalbags new book, Accessibility for Everyone, available now from A Book Apart.Incorpora...",https://alistapart.com/article/planning-for-accessibility,0,alistapart,,https://alistapart.com/d/planning-for-accessibility/accessibility-for-everyone-300x464.png,2017-11-09,0
Ten Extras for Great API Documentation,"If you manage to create amazing API documentation and ensure that developers have a positive experience implementing your API, they will sing the praises of your product. Continuously improving your A...",https://alistapart.com/article/ten-extras-for-great-api-documentation,0,alistapart,,,2017-11-07,0
What the Failure of New Coke Can Teach Us About User Research And Design,"In the late 1970s, Pepsi was running behind Coca-Cola in the competition to be the leading cola. But then Pepsi discovered that in blind taste tests, people actually preferred the sweeter taste of Pep...",https://alistapart.com/article/what-the-failure-of-new-coke-can-teach-us-about-user-research-and-design,0,alistapart,,https://alistapart.com/d/failure-of-new-coke/book-1.png,2017-11-02,0
"Web Typography: Designing Tables to be Read, Not Looked At","A note from the editors: We’re pleased to share an excerpt from Chapter 2 of Richard Rutter’s new book, Web Typography.Good designers spend a great deal of time sweating over typography. They agonise ...",https://alistapart.com/article/web-typography-tables,0,alistapart,,https://alistapart.com/d/web-typography-tables/2-tables-numerals.svg,2017-10-31,0
Coding with Clarity,"Working code isn’t necessarily good code. Your code also needs to be easy to read, understand, and modify. It needs clarity, and to achieve that, it has to be organized well, with careful planning and...",https://alistapart.com/article/coding-with-clarity,0,alistapart,,,2017-10-26,0
"The New CSS Layout, An Excerpt","A note from the editors: We’re pleased to share an excerpt from Chapter 3 (“The New Layout”) of Rachel Andrew’s new book, The New CSS Layout, available now from A Book Apart.As we have seen, flexbox w...",https://alistapart.com/article/the-new-css-layout-excerpt,0,alistapart,"javascript,jquery,bootstrap,frontend,html,react",,2017-10-24,0
"The Story of CSS Grid, from Its Creators",A note from the editors: We want to thank the Microsoft Edge team for sharing transcripts of the interviews they conducted with many of the brilliant people who have contributed to the development of ...,https://alistapart.com/article/the-story-of-css-grid-from-its-creators,0,alistapart,"javascript,jquery,bootstrap,frontend,html,react",,2017-10-19,0
Web Typography: Numerals,"A note from the editors: We’re pleased to share an excerpt from Chapter 2 of Richard Rutter’s new book, Web Typography.When it comes to numbers we have just ten digits. Throw in a comma and a period a...",https://alistapart.com/article/web-typography-numerals,0,alistapart,,https://alistapart.com/d/web-typography-numbers/2-tables-times-georgia.png,2017-10-17,0
"The Right Way to Select Technology, An Excerpt","A note from the editors: We’re pleased to share an excerpt from Chapter 4 of Tony Byrne and Jarrod Gingras’s new book, The Right Way to Select Technology, available now from Rosenfeld Media.After esta...",https://alistapart.com/article/the-right-way-to-select-technology-excerpt,0,alistapart,,,2017-10-12,0
UX for Lizard Brains,"Technology can make magic happen. In seconds, you can find all the blue sandals in a warehouse of millions of shoes. A million people can read the same article without killing one tree. You can undo, ...",https://alistapart.com/article/ux-for-lizard-brains,0,alistapart,,https://alistapart.com/d/ux-for-lizard-brains/fig1.png,2017-10-10,0
Be a Mentor,"Looking back over my eleven-year career in the web industry, I owe most of my success to two people from early on: Holly and Rebecca. Both were supervisors; but, more importantly, both were mentors. I...",https://alistapart.com/article/be-a-mentor,0,alistapart,"database,mysql,docker,backend",,2017-10-05,0
Using Webfonts,"A note from the editors: We’re pleased to share an excerpt from Chapter 2 (“Using Webfonts) of Bram Steins new book, Webfont Handbook, available now from A Book Apart.Now that you’ve selected a font, ...",https://alistapart.com/article/using-webfonts,0,alistapart,"javascript,jquery,css,frontend,react",https://alistapart.com/d/using-webfonts/webfont-handbook.png,2017-10-03,0
What I Talk About  When I Talk About Sorting: Untangling Array#sort,"Sorting things is a fundamental part of our daily lives—it’s something we do everyday to make our lives easier, following all kinds of criteria. Whether you’re looking for a person’s phone number, the...",https://alistapart.com/article/what-i-talk-about-when-i-talk-about-sorting,0,alistapart,,,2017-09-28,0
Considering Open Source Licenses,"So you have a project that you want to use open source tools to create—well, I tip my hat off to you as a developer. But do you know the questions you need to answer before you get started?Want the be...",https://alistapart.com/article/considering-open-source-licenses,0,alistapart,,https://alistapart.com/d/considering-open-source-licenses/fig1.png,2017-09-26,0
