title,content,url,cnt,source,keyword,image,createdAt,priority
Global Languages Support at Netflix,"Having launched the Netflix service globally in January, we now support search in 190 countries. We currently support 20 languages, and this will continue to grow over time. Some of the most challengi...",https://medium.com/netflix-techblog/global-languages-support-at-netflix-testing-search-queries-ede40f7d93d3?source=collection_home---4------17---------------------,0,netflix,"css,react,javascript,python,frontend",,2016-07-12,0
Product Integration Testing at the Speed of Netflix,"The Netflix member experience is delivered using a micro-service architecture and is personalized to each of our 80+ million members. These services are owned by multiple teams, each having their own ...",https://medium.com/netflix-techblog/product-integration-testing-at-the-speed-of-netflix-72e4117734a7?source=collection_home---4------18---------------------,0,netflix,,,2016-07-05,0
Netflix and the IMF Community,"When you’ve got something this good, it’s hard to keep it to yourself. As we develop our IMF validation tools internally, we are merging them into a public git repository. The project, code-named Phot...",https://medium.com/netflix-techblog/netflix-and-the-imf-community-7117a66b3c47?source=collection_home---4------19---------------------,0,netflix,,,2016-06-27,0
Netflix Billing Migration to AWS,"On January 4, 2016, right before Netflix expanded itself into 130 new countries, Netflix Billing infrastructure became 100% AWS cloud-native. Migration of Billing infrastructure from Netflix Data Cent...",https://medium.com/netflix-techblog/netflix-billing-migration-to-aws-451fba085a4?source=collection_home---4------20---------------------,0,netflix,"android,java,cloud,python,django,docker,backend",,2016-06-21,0
Toward A Practical Perceptual Video Quality Metric,"by Zhi Li, Anne Aaron, Ioannis Katsavounidis, Anush Moorthy and Megha ManoharaAt Netflix we care about video quality, and we care about measuring video quality accurately at scale. Our method, Video M...",https://medium.com/netflix-techblog/toward-a-practical-perceptual-video-quality-metric-653f208b9652?source=collection_home---4------21---------------------,0,netflix,"android,css,react,tensorflow,python,machinelearning,frontend,docker",,2016-06-06,0
Dynomite-manager: Managing Dynomite Clusters,"Dynomite has been adopted widely inside Netflix due to its high performance and low latency attributes. In our recent blog, we showcased the performance of Dynomite with Redis as the underlying data s...",https://medium.com/netflix-techblog/dynomite-manager-managing-dynomite-clusters-dfb6874228e4?source=collection_home---4------22---------------------,0,netflix,"mysql,mongodb,database,docker,backend",,2016-06-01,0
Meson: Workflow Orchestration for Netflix Recommendations,"At Netflix, our goal is to predict what you want to watch before you watch it. To do this, we run a large number of machine learning (ML) workflows every day. In order to support the creation of these...",https://medium.com/netflix-techblog/meson-workflow-orchestration-for-netflix-recommendations-fc932625c1d9?source=collection_home---4------23---------------------,0,netflix,"webpack,css,angular,javascript,cloud,python,frontend,docker,backend",,2016-05-31,0
Application data caching using SSDs,"With the global expansion of Netflix earlier this year came the global expansion of data. After the Active-Active project and now with the N+1 architecture, the latest personalization data needs to be...",https://medium.com/netflix-techblog/application-data-caching-using-ssds-5bf25df851ef?source=collection_home---4------0---------------------,0,netflix,,,2016-05-25,0
Highlights from PRS2016 workshop,Personalized recommendations and search are the primary ways Netflix members find great content to watch. We’ve written much about how we build them and some of the open challenges. Recently we organi...,https://medium.com/netflix-techblog/highlights-from-prs2016-workshop-57f36fa34b44?source=collection_home---4------3---------------------,0,netflix,"ruby,material,css,javascript,python,html,frontend,php",,2016-05-05,0
Selecting the best artwork for videos through A/B testing,"At Netflix, we are constantly looking at ways to help our 81.5M members discover great stories that they will love. A big part of that is creating a user experience that is intuitive, fun, and meaning...",https://medium.com/netflix-techblog/selecting-the-best-artwork-for-videos-through-a-b-testing-f6155c4595f6?source=collection_home---4------4---------------------,0,netflix,,,2016-05-03,0
It’s All A/Bout Testing: The Netflix Experimentation Platform,Ever wonder how Netflix serves a great streaming experience with high-quality video and minimal playback interruptions? Thank the team of engineers and data scientists who constantly A/B test their in...,https://medium.com/netflix-techblog/its-all-a-bout-testing-the-netflix-experimentation-platform-4e1ca458c15?source=collection_home---4------5---------------------,0,netflix,,,2016-04-29,0
Kafka Inside Keystone Pipeline,"This is the second blog of our Keystone pipeline series. Please refer to the first part for overview and evolution of the Keystone pipeline:In summary, the Keystone pipeline is a unified event publish...",https://medium.com/netflix-techblog/kafka-inside-keystone-pipeline-dd5aeabaf6bb?source=collection_home---4------6---------------------,0,netflix,docker,,2016-04-27,0
A Scalable System for Ingestion and Delivery of Timed Text,Offering the same great Netflix experience to diverse audiences and cultures around the world is a core aspect of the global Netflix video delivery service. With high quality subtitle localization bei...,https://medium.com/netflix-techblog/a-scalable-system-for-ingestion-and-delivery-of-timed-text-6f4287a8a600?source=collection_home---4------7---------------------,0,netflix,"css,react,python,frontend,docker",,2016-04-18,0
Saving 13 Million Computational Minutes per Day with Flame Graphs,"We recently uncovered a significant performance win for a key microservice here at Netflix, and we want to share the problems, challenges, and new developments for the kind of analysis that lead us to...",https://medium.com/netflix-techblog/saving-13-million-computational-minutes-per-day-with-flame-graphs-d95633b6d01f?source=collection_home---4------8---------------------,0,netflix,"frontend,animation",,2016-04-11,0
The Netflix IMF Workflow,"Following our introductory article, this (the second in our IMF series) post describes the Netflix IMF ingest implementation and how it fits within the scope of our content processing pipeline. While ...",https://medium.com/netflix-techblog/the-netflix-imf-workflow-f45dd72ed700?source=collection_home---4------9---------------------,0,netflix,"webpack,css,angular,javascript,python,frontend,docker",,2016-04-04,0
How Netflix Uses John Stamos to Optimize the Cloud at Scale,"Netflix Technology relies heavily on the Cloud, thanks to its low latency and high compatibility with the internet.But the key to great Technology is having great Talent. So when John Stamos expressed...",https://medium.com/netflix-techblog/how-netflix-uses-john-stamos-to-optimize-the-cloud-at-scale-5a05a3bbf2eb?source=collection_home---4------10---------------------,0,netflix,"python,django,animation,frontend,docker",,2016-04-01,0
Global Cloud — Active-Active and Beyond,This is a continuing post on the Netflix architecture for Global Availability. In the past we talked about efforts like Isthmus and Active-Active:We continue the story from where we left off at the en...,https://medium.com/netflix-techblog/global-cloud-active-active-and-beyond-a0fdfa2c3a45?source=collection_home---4------11---------------------,0,netflix,,,2016-03-30,0
Extracting image metadata at scale,We have a collection of nearly two million images that play very prominent roles in helping members pick what to watch. This blog describes how we use computer vision algorithms to address the challen...,https://medium.com/netflix-techblog/extracting-image-metadata-at-scale-c89c60a2b9d2?source=collection_home---4------13---------------------,0,netflix,"json,machinelearning,python,animation,frontend,caffe,docker,backend",,2016-03-21,0
Stream-processing with Mantis,"Back in January of 2014 we wrote about the need for better visibility into our complex operational environments:The core of the message in that post was about the need for fine-grained, contextual and...",https://medium.com/netflix-techblog/stream-processing-with-mantis-78af913f51a6?source=collection_home---4------14---------------------,0,netflix,,,2016-03-14,0
How We Build Code at Netflix,"How does Netflix build code before it’s deployed to the cloud? While pieces of this story have been told in the past, we decided it was time we shared more details. In this post, we describe the tools...",https://medium.com/netflix-techblog/how-we-build-code-at-netflix-c5d9bd727f15?source=collection_home---4------15---------------------,0,netflix,,,2016-03-09,0
IMF: A Prescription for Versionitis,"This blog post provides an introduction to the emerging IMF (Interoperable Master Format) standard from SMPTE (The Society of Motion Picture and Television Engineers), and delves into a short case stu...",https://medium.com/netflix-techblog/imf-a-prescription-for-versionitis-e0b4c1865c20?source=collection_home---4------16---------------------,0,netflix,,,2016-03-07,0
Caching for a Global Netflix,"Netflix members have come to expect a great user experience when interacting with our service. There are many things that go into delivering a customer-focused user experience for a streaming service,...",https://medium.com/netflix-techblog/caching-for-a-global-netflix-7bcc457012f1?source=collection_home---4------17---------------------,0,netflix,,,2016-03-01,0
Recommending for the World,"by Yves Raimond and Justin BasilicoThe Netflix experience is driven by a number of Machine Learning algorithms: personalized ranking, page generation, search, similarity, ratings, etc. On the 6th of J...",https://medium.com/netflix-techblog/recommending-for-the-world-8da8cbcf051b?source=collection_home---4------18---------------------,0,netflix,,,2016-02-17,0
Evolution of the Netflix Data Pipeline,"Our new Keystone data pipeline went live in December of 2015. In this article, we talk about the evolution of Netflix’s data pipeline over the years. This is the first of a series of articles about th...",https://medium.com/netflix-techblog/evolution-of-the-netflix-data-pipeline-da246ca36905?source=collection_home---4------19---------------------,0,netflix,python,,2016-02-15,0
Distributed Time Travel for Feature Generation,"We want to make it easy for Netflix members to find great content to fulfill their unique tastes. To do this, we follow a data-driven algorithmic approach based on machine learning, which we have desc...",https://medium.com/netflix-techblog/distributed-time-travel-for-feature-generation-389cccdd3907?source=collection_home---4------20---------------------,0,netflix,"javascript,vue,frontend",,2016-02-12,0
Automated Failure Testing,"At Netflix, we have found that proactive failure testing is a great way to ensure that we have a reliable product for our members by helping us prepare our systems, and our teams, for the problems tha...",https://medium.com/netflix-techblog/automated-failure-testing-86c1b8bc841f?source=collection_home---4------22---------------------,0,netflix,,,2016-01-20,0
Dynomite with Redis on AWS — Benchmarks,About a year ago the Cloud Database Engineering (CDE) team published a post Introducing Dynomite.Dynomite is a proxy layer that provides sharding and replication and can turn existing non-distributed ...,https://medium.com/netflix-techblog/dynomite-with-redis-on-aws-benchmarks-5c942fc7ca38?source=collection_home---4------23---------------------,0,netflix,"mysql,mongodb,database,docker,backend",,2016-01-14,0
Per-Title Encode Optimization,"We’ve spent years developing an approach, called per-title encoding, where we run analysis on an individual title to determine the optimal encoding recipe based on its complexity. Imagine having very ...",https://medium.com/netflix-techblog/per-title-encode-optimization-7e99442b62a2?source=collection_home---4------1---------------------,0,netflix,,,2015-12-14,0
Optimizing Content Quality Control at Netflix with Predictive Modeling,"by Nirmal Govind and Athula BalachandranOver 69 million Netflix members stream billions of hours of movies and shows every month in North and South America, parts of Europe and Asia, Australia and New...",https://medium.com/netflix-techblog/optimizing-content-quality-control-at-netflix-with-predictive-modeling-712281658ab9?source=collection_home---4------2---------------------,0,netflix,"react,frontend,css,docker",,2015-12-10,0
High Quality Video Encoding at Scale,At Netflix we receive high quality sources for our movies and TV shows and encode them to the best video streams possible for a given member’s viewing device and bandwidth capabilities. With the conti...,https://medium.com/netflix-techblog/high-quality-video-encoding-at-scale-d159db052746?source=collection_home---4------3---------------------,0,netflix,"css,react,python,frontend,animation,docker",,2015-12-09,0
Caching Content for Holiday Streaming,"’Tis the season for holiday binging. How do seasonal viewing patterns affect how Netflix stores and streams content?Our solution for delivering streaming content is Open Connect, a custom-built system...",https://medium.com/netflix-techblog/caching-content-for-holiday-streaming-be3792f1d77c?source=collection_home---4------5---------------------,0,netflix,android,,2015-12-01,0
Creating Your Own EC2 Spot Market — Part 2,"In Part 1 Creating Your Own EC2 Spot Market of this series, we explained how Netflix manages its EC2 footprint and how we take advantage of our daily peak of 12,000 unused instances which we named the...",https://medium.com/netflix-techblog/creating-your-own-ec2-spot-market-part-2-106e53be9ed7?source=collection_home---4------7---------------------,0,netflix,,,2015-11-23,0
Sleepy Puppy Extension for Burp Suite,Netflix recently open sourced Sleepy Puppy — a cross-site scripting (XSS) payload management framework for security assessments.One of the most frequently requested features for Sleepy Puppy has been ...,https://medium.com/netflix-techblog/sleepy-puppy-extension-for-burp-suite-ca45b80936af?source=collection_home---4------8---------------------,0,netflix,"backend,json",,2015-11-20,0
Global Continuous Delivery with Spinnaker,"After over a year of development and production use at Netflix, we’re excited to announce that our Continuous Delivery platform, Spinnaker, is available on GitHub. Spinnaker is an open source multi-cl...",https://medium.com/netflix-techblog/global-continuous-delivery-with-spinnaker-2a6896c23ba7?source=collection_home---4------9---------------------,0,netflix,,,2015-11-16,0
Netflix Hack Day — Autumn 2015,"by Daniel Jacobson, Ruslan Meshenberg, Matt McCarthy, and Leslie PosadaLast week, we hosted our latest installment of Netflix Hack Day. As always, Hack Day is a way for our product development staff t...",https://medium.com/netflix-techblog/netflix-hack-day-autumn-2015-13b487011031?source=collection_home---4------10---------------------,0,netflix,"css,python,html,frontend,php",,2015-11-09,0
Evolution of Open Source at Netflix,"When we started our Netflix Open Source (aka NetflixOSS) Program several years ago, we didn’t know how it would turn out. We did not know whether our OSS contributions would be used, improved, or igno...",https://medium.com/netflix-techblog/evolution-of-open-source-at-netflix-d05c1c788429?source=collection_home---4------11---------------------,0,netflix,,,2015-10-28,0
Falcor for Android,"We’re happy to have open-sourced the Netflix Falcor library earlier this year. On Android, we wanted to make use of Falcor in our client app for its efficient model of data fetching as well as its inh...",https://medium.com/netflix-techblog/falcor-for-android-9a2b56ba94f5?source=collection_home---4------12---------------------,0,netflix,"backend,webpack,angular,react,javascript,frontend,router",,2015-10-20,0
Flux: A New Approach to System Intuition,"On the Traffic and Chaos Teams at Netflix, our mission requires that we have a holistic understanding of our complex microservice architecture. At any given time, we may be called upon to move the req...",https://medium.com/netflix-techblog/flux-a-new-approach-to-system-intuition-cf428b7316ec?source=collection_home---4------14---------------------,0,netflix,,,2015-10-01,0
Creating Your Own EC2 Spot Market,"by Andrew Park, Darrell Denlinger, & Coburn WatsonNetflix prioritizes innovation and reliability above efficiency, and as we continue to scale globally, finding opportunities that balance these three ...",https://medium.com/netflix-techblog/creating-your-own-ec2-spot-market-6dd001875f5?source=collection_home---4------16---------------------,0,netflix,,,2015-09-28,0
Chaos Engineering Upgraded,Several years ago we introduced a tool called Chaos Monkey. This service pseudo-randomly plucks a server from our production deployment on AWS and kills it. At the time we were met with incredulity an...,https://medium.com/netflix-techblog/chaos-engineering-upgraded-878d341f15fa?source=collection_home---4------17---------------------,0,netflix,,,2015-09-25,0
John Carmack on Developing the Netflix App for Oculus,"Hi, this is Anthony Park, VP of Engineering at Netflix. We’ve been working with Oculus to develop a Netflix app for Samsung Gear VR. The app includes a Netflix Living Room, allowing members to get the...",https://medium.com/netflix-techblog/john-carmack-on-developing-the-netflix-app-for-oculus-2c8170aaef00?source=collection_home---4------18---------------------,0,netflix,android,,2015-09-24,0
Announcing Electric Eye,"by Michael RussellNetflix ships on a wide variety of devices, ranging from small thumbdrive-sized HDMI dongles to ultra-massive 100”+ curved screen HDTVs, and the wide variety of form factors leads to...",https://medium.com/netflix-techblog/announcing-electric-eye-2bb8ffcf9b1b?source=collection_home---4------19---------------------,0,netflix,"machinelearning,caffe",,2015-09-22,0
Introducing Lemur,"by Kevin Glisson, Jason Chan, and Ben HagenNetflix is pleased to announce the open source release of our x.509 certificate orchestration framework: Lemur!Public Key Infrastructure is a set of hardware...",https://medium.com/netflix-techblog/introducing-lemur-ceae8830f621?source=collection_home---4------20---------------------,0,netflix,,,2015-09-21,0
Announcing Sleepy Puppy — Cross-Site Scripting Payload Management for Web Application Security Testing,by Scott Behrens and Patrick KelleyNetflix is pleased to announce the open source release of our cross-site scripting (XSS) payload management framework: Sleepy Puppy!Cross-site scripting is a type of...,https://medium.com/netflix-techblog/announcing-sleepy-puppy-cross-site-scripting-payload-management-for-web-application-security-d32e62d72e29?source=collection_home---4------21---------------------,0,netflix,"backend,json",,2015-08-31,0
From Chaos to Control — Testing the resiliency of Netflix’s Content Discovery Platform,"by Leena Janardanan, Bruce Wobbe, Vilas VeeraraghavanMerchandising Application Platform (MAP) was conceived as a middle-tier service that would handle real time requests for content discovery. MAP doe...",https://medium.com/netflix-techblog/from-chaos-to-control-testing-the-resiliency-of-netflixs-content-discovery-platform-ce5566aef0a4?source=collection_home---4------22---------------------,0,netflix,,,2015-08-25,0
Fenzo: OSS Scheduler for Apache Mesos Frameworks,"Bringing Netflix to our millions of subscribers is no easy task. The product comprises dozens of services in our distributed environment, each of which is operating a critical component to the experie...",https://medium.com/netflix-techblog/fenzo-oss-scheduler-for-apache-mesos-frameworks-5c340e77e543?source=collection_home---4------23---------------------,0,netflix,,,2015-08-20,0
Making Netflix.com Faster,"by Kristofer BaxterSimply put, performance matters. We know members want to immediately start browsing or watching their favorite content and have found that faster startup leads to more satisfying us...",https://medium.com/netflix-techblog/making-netflix-com-faster-f95d15f2e972?source=collection_home---4------1---------------------,0,netflix,,,2015-08-05,0
Netflix at Velocity 2015: Linux Performance Tools,"There are many performance tools nowadays for Linux, but how do they all fit together, and when do we use them? At Velocity 2015, I gave a 90 minute tutorial on Linux performance tools. I’ve spoken on...",https://medium.com/netflix-techblog/netflix-at-velocity-2015-linux-performance-tools-51964ddb81cf?source=collection_home---4------2---------------------,0,netflix,"angular,react,javascript,python,frontend",,2015-08-03,0
"Tuning Tomcat For A High Throughput, Fail Fast System","by Sumit TandonNetflix has a number of high throughput, low latency mid tier services. In one of these services, it was observed that in case there is a huge surge in traffic in a very short span of t...",https://medium.com/netflix-techblog/tuning-tomcat-for-a-high-throughput-fail-fast-system-e4d7b2fc163f?source=collection_home---4------3---------------------,0,netflix,docker,,2015-07-28,0
Java in Flames,Java mixed-mode flame graphs provide a complete visualization of CPU usage and have just been made possible by a new JDK option: -XX:+PreserveFramePointer. We’ve been developing these at Netflix for e...,https://medium.com/netflix-techblog/java-in-flames-e763b3d32166?source=collection_home---4------4---------------------,0,netflix,"cuda,machinelearning,android,python",,2015-07-24,0
Tracking down the Villains: Outlier Detection at Netflix,"It’s 2 a.m. and half of our reliability team is online searching for the root cause of why Netflix streaming isn’t working. None of our systems are obviously broken, but something is amiss and we’re n...",https://medium.com/netflix-techblog/tracking-down-the-villains-outlier-detection-at-netflix-40360b31732?source=collection_home---4------5---------------------,0,netflix,"tensorflow,python,machinelearning",,2015-07-14,0
NTS: Real-time Streaming for Test Automation,by Peter Hausel and Jwalant ShahNetflix members can enjoy instant access to TV shows & Movies on over 1400 different device/OS permutations. Assessing long-duration playback quality and delivering a g...,https://medium.com/netflix-techblog/nts-real-time-streaming-for-test-automation-7cb000e933a1?source=collection_home---4------6---------------------,0,netflix,"android,css,react,frontend,docker",,2015-06-15,0
Localization Technologies at Netflix,"The localization program at Netflix is centered around linguistic excellence, a great team environment, and cutting-edge technology. The program is only 4 years old, which for a company our size is un...",https://medium.com/netflix-techblog/localization-technologies-at-netflix-d033e7b13cf?source=collection_home---4------7---------------------,0,netflix,,,2015-06-04,0
Introducing FIDO: Automated Security Incident Response,"We’re excited to announce the open source release of FIDO (Fully Integrated Defense Operation — apologies to the FIDO Alliance for acronym collision), our system for automatically analyzing security e...",https://medium.com/netflix-techblog/introducing-fido-automated-security-incident-response-1961f34f7da3?source=collection_home---4------9---------------------,0,netflix,ruby,,2015-05-04,0
Learning a Personalized Homepage,"by Chris Alvino and Justin BasilicoAs we’ve described in our previous blog posts, at Netflix we use personalization extensively and treat every situation as an opportunity to present the right content...",https://medium.com/netflix-techblog/learning-a-personalized-homepage-aa8ec670359a?source=collection_home---4------10---------------------,0,netflix,,,2015-04-09,0
Introducing Vector: Netflix’s On-Host Performance Monitoring Tool,"by Martin Spier, Amer Ather, and Brendan GreggVector is an open source host-level performance monitoring framework, which exposes hand-picked, high-resolution system and application metrics to every e...",https://medium.com/netflix-techblog/introducing-vector-netflixs-on-host-performance-monitoring-tool-c0d3058c3f6f?source=collection_home---4------11---------------------,0,netflix,"python,docker",,2015-04-08,0
Extracting contextual information from video assets,"by Apurva KansaraHere, I will describe our approach to extract contextual metadata from video assets to enable an improved Netflix user experience across the large catalog we serve.When you finish wat...",https://medium.com/netflix-techblog/extracting-contextual-information-from-video-assets-ee9da25b6008?source=collection_home---4------12---------------------,0,netflix,"python,android,java",,2015-04-06,0
Billing & Payments Engineering Meetup II,"On March 18th, we hosted our second Billing & Payments Engineering Meetup at Netflix. It felt truly encouraging to see the growing interest of the engineer community of the Bay Area for the event. Jus...",https://medium.com/netflix-techblog/billing-payments-engineering-meetup-ii-3bec782b3059?source=collection_home---4------13---------------------,0,netflix,"android,webpack,css,angular,java,javascript,python,frontend,docker",,2015-03-30,0
