title,content,url,cnt,source,keyword,image,createdAt,priority
Scaling Time Series Data Storage — Part I,"The growth of internet connected devices has led to a vast amount of easily accessible time series data. Increasingly, companies are interested in mining this data to derive useful insights and make d...",https://medium.com/netflix-techblog/scaling-time-series-data-storage-part-i-ec2b6d44ba39?source=collection_home---4------20---------------------,0,netflix,"ruby,css,react,tensorflow,python,machinelearning,javascript,frontend",https://cdn-images-1.medium.com/max/1600/0*QHOtYeP8F9J46FRq.,2018-01-23,0
Integrating imperative APIs into a React application,"by Sriram RaoThe Netflix TV app plays videos not only when users choose to watch a title, but also while browsing to find something great to enjoy. When we rewrote our TV user interface in React, we s...",https://medium.com/netflix-techblog/integrating-imperative-apis-into-a-react-application-1257e1b45ac6?source=collection_home---4------22---------------------,0,netflix,"vue,angular,react,javascript,frontend,reactjs",https://cdn-images-1.medium.com/max/1600/1*F3QZZZE75wEzMxZT6opI5Q.png,2017-12-19,0
Distributing Content to Open Connect,"In previous posts we’ve talked about how we calculate, predict, and use content popularity for Open Connect to maximize the efficiency of our content delivery network and other data science challenges...",https://medium.com/netflix-techblog/distributing-content-to-open-connect-3e3e391d4dc9?source=collection_home---4------23---------------------,0,netflix,"python,android,java",https://cdn-images-1.medium.com/max/1600/1*7Dja7NTcH0UQhfL427L2lg.png,2017-12-12,0
Implementing Japanese Subtitles on Netflix,Japanese subtitles were first made available on the Netflix service as a part of the Japanese launch in September 2015. This blog post provides a technical description of the work we did leading up to...,https://medium.com/netflix-techblog/implementing-japanese-subtitles-on-netflix-c165fbe61989?source=collection_home---4------0---------------------,0,netflix,,,2017-12-11,0
Artwork Personalization at Netflix,"By Ashok Chandrashekar, Fernando Amat, Justin Basilico and Tony JebaraFor many years, the main goal of the Netflix personalized recommendation system has been to get the right titles in front each of ...",https://medium.com/netflix-techblog/artwork-personalization-c589f074ad76?source=collection_home---4------1---------------------,0,netflix,,https://cdn-images-1.medium.com/max/1600/0*038O1qN_N7lC3CGD.,2017-12-07,0
Innovating Faster on Personalization Algorithms at Netflix Using Interleaving,"By Juliette Aurisset, Michael Ramm, Joshua ParksThe Netflix experience is powered by a family of ranking algorithms, each optimized for a different purpose. For instance, the Top Picks row on the home...",https://medium.com/netflix-techblog/interleaving-in-online-experiments-at-netflix-a04ee392ec55?source=collection_home---4------2---------------------,0,netflix,,https://cdn-images-1.medium.com/max/1600/0*baj8e-s1v5hJRm6A.,2017-11-29,0
Updates on Netflix’s Container Management Platform,We continue to share lessons learned from scheduling and executing containers in production at scale. This blog posts summarizes not only recent publications on our container management platform (Proj...,https://medium.com/netflix-techblog/updates-on-netflixs-container-management-platform-a91738360bd8?source=collection_home---4------4---------------------,0,netflix,,https://cdn-images-1.medium.com/max/1600/1*Qd0omPjkQ21JJfJOMNPr5g.jpeg,2017-11-14,0
Machine Learning Platform meetup,"By Faisal SiddiqiMachine Learning is making fast inroads into many areas of business and is being employed in an increasingly widening array of commercial applications. At Netflix, ML has been used fo...",https://medium.com/netflix-techblog/machine-learning-platform-meetup-ddec090f3c17?source=collection_home---4------6---------------------,0,netflix,,https://cdn-images-1.medium.com/max/1600/0*ubFQaXg4cKDK6MDP.,2017-10-18,0
Developer Experience Lessons Operating a Serverless-like Platform At Netflix — Part II,"By Ludovic Galibert, Vasanth Asokan and Sangeeta NarayananIn Part 1 of this series, we outlined key learnings the Edge Developer Experience team gained from operating the API dynamic scripting platfor...",https://medium.com/netflix-techblog/developer-experience-lessons-operating-a-serverless-like-platform-at-netflix-part-ii-63a376c28228?source=collection_home---4------7---------------------,0,netflix,,https://cdn-images-1.medium.com/max/1600/1*W6vAWf60GJ1davcvGWDiiA.png,2017-10-12,0
Serving 100 Gbps from an Open Connect Appliance,"In the summer of 2015, the Netflix Open Connect CDN team decided to take on an ambitious project. The goal was to leverage the new 100GbE network interface technology just coming to market in order to...",https://medium.com/netflix-techblog/serving-100-gbps-from-an-open-connect-appliance-cdb51dda3b99?source=collection_home---4------8---------------------,0,netflix,,https://cdn-images-1.medium.com/max/1600/1*lTGL1_D6hTMEMa7EDV8yZA.png,2017-09-29,0
"Scaling Event Sourcing for Netflix Downloads, Episode 2","by Karen Casella, Phillipa Avery, Robert Reta, Joseph BreuerIn the first episode of this series of posts, we introduced the Netflix downloads project and the use cases that led us to consider a soluti...",https://medium.com/netflix-techblog/scaling-event-sourcing-for-netflix-downloads-episode-2-ce1b54d46eec?source=collection_home---4------9---------------------,0,netflix,,https://cdn-images-1.medium.com/max/1600/0*CRWUAIP4Ak7QrahS.,2017-09-18,0
"Scaling Event Sourcing for Netflix Downloads, Episode 1","by Karen Casella, Phillipa Avery, Robert Reta, Joseph BreuerEarly in 2016, several Netflix teams were asked the question: “What would it take to allow members to download and view content offline on t...",https://medium.com/netflix-techblog/scaling-event-sourcing-for-netflix-downloads-episode-1-6bc1595c5595?source=collection_home---4------10---------------------,0,netflix,,https://cdn-images-1.medium.com/max/1600/1*XoUpg2CK_w8UPQOAJ3Yelw.png,2017-09-11,0
Netflix Hack Day — Summer 2017,"by Daniel Jacobson, Ruslan Meshenberg, Leslie Posada, and Tom RichardsAbout a week ago, Netflix hosted another great Hack Day. The event gives Netflix employees a chance to take a break from everyday ...",https://medium.com/netflix-techblog/netflix-hack-day-summer-2017-ef3ba81a8a77?source=collection_home---4------11---------------------,0,netflix,"css,python,html,frontend,php",https://cdn-images-1.medium.com/max/1600/0*ux_3Hh_tn9QfhEQH.,2017-08-29,0
Starting the Avalanche,By Scott Behrens and Bryan PayneWe’d like to introduce you to one of the most devastating ways to cause service instability in modern micro-service architectures: application DDoS. A specially crafted...,https://medium.com/netflix-techblog/starting-the-avalanche-640e69b14a06?source=collection_home---4------13---------------------,0,netflix,,,2017-07-28,0
ChAP: Chaos Automation Platform,"We are excited to announce ChAP, the newest member of our chaos tooling family! Chaos Monkey and Chaos Kong ensure our resilience to instance and regional failures, but threats to availability can als...",https://medium.com/netflix-techblog/chap-chaos-automation-platform-53e6d528371f?source=collection_home---4------14---------------------,0,netflix,,https://cdn-images-1.medium.com/max/1600/1*LwspfR7nJVMzmXT940pRnQ.png,2017-07-26,0
Developer Experience Lessons Operating a Serverless-like Platform At Netflix,"By Vasanth Asokan, Ludovic Galibert and Sangeeta NarayananThe Netflix API is based on a dynamic scripting platform that handles thousands of changes per day. This platform allows our client developers...",https://medium.com/netflix-techblog/developer-experience-lessons-operating-a-serverless-like-platform-at-netflix-a8bbd5b899a0?source=collection_home---4------15---------------------,0,netflix,,https://cdn-images-1.medium.com/max/1600/1*aqF2NHW1nKRqwiQ5gmXRzA.png,2017-07-11,0
Content Popularity for Open Connect,"There are many reasons why Netflix cares about the popularity of our TV shows and movies. On the Open Connect Content Delivery team, we predict content popularity to maximize our infrastructure effici...",https://medium.com/netflix-techblog/content-popularity-for-open-connect-b86d56f613b?source=collection_home---4------17---------------------,0,netflix,"cloud,docker,backend",https://cdn-images-1.medium.com/max/1600/1*GYK_x9A7H1WHcLWs4Vi4Qw.png,2017-06-20,0
A/B Testing and Beyond: Improving the Netflix Streaming Experience with Experimentation and Data Science,"by Nirmal GovindGolden Globes for The Crown. An Oscar win for The White Helmets. It’s an exciting time to be a Netflix member, with the power to stream such incredible content on a Smart TV or a mobil...",https://medium.com/netflix-techblog/a-b-testing-and-beyond-improving-the-netflix-streaming-experience-with-experimentation-and-data-5b0ae9295bdf?source=collection_home---4------18---------------------,0,netflix,"android,python",https://cdn-images-1.medium.com/max/1600/0*M5QhuZHe-1fbryUi.,2017-06-13,0
Evolving the Netflix Data Platform with Genie 3,"by Tom GianosThe big data space continues to change at a rapid pace. Data scientists and analysts have more tools than ever at their disposal whether it be Spark, R, Presto, or traditional engines lik...",https://medium.com/netflix-techblog/evolving-the-netflix-data-platform-with-genie-3-598021604dda?source=collection_home---4------19---------------------,0,netflix,,https://cdn-images-1.medium.com/max/1600/0*D6TjU22i2ehz5MHy.,2017-06-07,0
Simone - A Distributed Simulation Service,"By Satyajit Thadeshwar, Mayank Agarwal, Sangeeta Narayanan & Kevin LewHundreds of models of smart TVs, game consoles, mobile devices, and other video streaming devices get shipped with a Netflix app p...",https://medium.com/netflix-techblog/https-medium-com-netflix-techblog-simone-a-distributed-simulation-service-b2c85131ca1b?source=collection_home---4------20---------------------,0,netflix,"matlab,python",https://cdn-images-1.medium.com/max/1600/1*U7EeMgb_g6npgzOfwQgdhg.png,2017-06-06,0
Introducing Aardvark and Repokid,"by Jason Chan, Patrick Kelley, and Travis McPeakToday we are pleased to announce two new open-source cloud security tools from Netflix: Aardvark and Repokid. Used together, these tools are the next lo...",https://medium.com/netflix-techblog/introducing-aardvark-and-repokid-53b081bf3a7e?source=collection_home---4------21---------------------,0,netflix,,https://cdn-images-1.medium.com/max/1200/1*3k7LOj-pk8aZYM7kXdCvdw.png,2017-06-05,0
How Data Science Helps Power Worldwide Delivery of Netflix Content,"by Andrew BerglundHave you ever wondered where your video comes from when you watch Netflix? We serve video streams out of our own content delivery network (CDN), called Open Connect, which is tailore...",https://medium.com/netflix-techblog/how-data-science-helps-power-worldwide-delivery-of-netflix-content-bac55800f9a7?source=collection_home---4------23---------------------,0,netflix,python,https://cdn-images-1.medium.com/max/1600/0*GS6-gWmNBuaYXulP.,2017-05-25,0
Automation as a Service — Introducing Scriptflask,"Authors : Fazal Allanabanda and Vilas VeeraraghavanLess than a year ago, we shared our testing wins and the challenges that lie ahead while testing High Impact Titles (HITs) globally. All this while e...",https://medium.com/netflix-techblog/automation-as-a-service-introducing-scriptflask-17a8e4ad954b?source=collection_home---4------0---------------------,0,netflix,,https://cdn-images-1.medium.com/max/1600/0*WpTbQEdZwGHAozwr.,2017-05-22,0
Pass the Remote: User Input on TV Devices,"by Andrew EichackerThe Netflix TV team works with device manufacturers to explore new input methods (like your phone!) and improve the screens we watch our favorite shows on. Beyond that, we’re testin...",https://medium.com/netflix-techblog/pass-the-remote-user-input-on-tv-devices-923f6920c9a8?source=collection_home---4------1---------------------,0,netflix,,https://cdn-images-1.medium.com/max/1600/1*xtU0fYmGc1ppbnDK1gzJIA.png,2017-05-17,0
The Evolution of Container Usage at Netflix,"Containers are already adding value to our proven globally available cloud platform based on Amazon EC2 virtual machines. We’ve shared pieces of Netflix’s container story in the past (video, slides), ...",https://medium.com/netflix-techblog/the-evolution-of-container-usage-at-netflix-3abfc096781b?source=collection_home---4------4---------------------,0,netflix,"animation,python,frontend,docker",https://cdn-images-1.medium.com/max/1600/1*uqWK-Dj9LuPKuJYWj6F9aw.png,2017-04-18,0
Introducing Bolt: On Instance Diagnostic and Remediation Platform,"Last August we introduced Winston, our event driven diagnostic and remediation platform. Winston helps orchestrate diagnostic and remediation actions from the outside. As part of that orchestration, t...",https://medium.com/netflix-techblog/introducing-bolt-on-instance-diagnostic-and-remediation-platform-176651b55505?source=collection_home---4------5---------------------,0,netflix,,https://cdn-images-1.medium.com/max/1600/0*bgBWxqICPurxGc_n.,2017-04-17,0
BetterTLS,"At Netflix we run a microservices architecture that has hundreds of independent applications running throughout our ecosystem. One of our goals, in the interest of implementing security in depth, is t...",https://medium.com/netflix-techblog/bettertls-c9915cd255c0?source=collection_home---4------6---------------------,0,netflix,,https://cdn-images-1.medium.com/max/1600/1*8PB_N4zK5RoKLxpsbW0Now.png,2017-04-10,0
Netflix Conductor: Inversion of Control for workflows,"In December 2016, we open sourced Netflix Conductor.We have been working hard since then to add more features, enhance the user interface for monitoring the workflows, and harden the system. We have s...",https://medium.com/netflix-techblog/netflix-conductor-inversion-of-control-for-workflows-c495621bc1c5?source=collection_home---4------7---------------------,0,netflix,,https://cdn-images-1.medium.com/max/1200/0*uSlAzzSttF-FZkNz.png,2017-04-06,0
The Netflix HERMES Test: Quality Subtitling at Scale,"Since Netflix launched globally, the scale of our localization efforts has increased dramatically. It’s hard to believe that just 5 years ago, we only supported English, Spanish and Portuguese. Now we...",https://medium.com/netflix-techblog/the-netflix-hermes-test-quality-subtitling-at-scale-dccea2682aef?source=collection_home---4------8---------------------,0,netflix,"css,react,python,animation,frontend,docker",https://cdn-images-1.medium.com/max/1200/0*IO_ZqzQ6PJmrid5M.,2017-03-30,0
Netflix Security Monkey on Google Cloud Platform (GCP),Today we are happy to announce that Netflix Security Monkey has BETA support for tracking Google Cloud Platform (GCP) services. Initially we are providing support for the following GCP services:This w...,https://medium.com/netflix-techblog/netflix-security-monkey-on-google-cloud-platform-gcp-f221604c0cc7?source=collection_home---4------10---------------------,0,netflix,"webpack,react,javascript,python,django,frontend,docker",,2017-03-13,0
Netflix Downloads on Android,"by Greg Benson, Francois Goldfain, and Ashish GuptaNetflix is now a global company, so we wanted to provide a viewing experience that was truly available everywhere even when the Internet is not worki...",https://medium.com/netflix-techblog/netflix-downloads-on-android-d79db40f1732?source=collection_home---4------11---------------------,0,netflix,,,2017-03-08,0
Introducing Netflix Stethoscope,"Netflix is pleased to announce the open source release of Stethoscope, our first project following a User Focused Security approach.The notion of “User Focused Security” acknowledges that attacks agai...",https://medium.com/netflix-techblog/introducing-netflix-stethoscope-5f3c392368e3?source=collection_home---4------12---------------------,0,netflix,,,2017-02-21,0
Introducing HubCommander,"by Mike Grima, Andrew Spyker, and Jason ChanNetflix is pleased to announce the open source release of HubCommander, a ChatOps tool for GitHub management.Netflix uses GitHub, a source code management a...",https://medium.com/netflix-techblog/introducing-hubcommander-1774d8f08fc6?source=collection_home---4------13---------------------,0,netflix,,,2017-02-07,0
Crafting a high-performance TV user interface using React,"by Ian McKayThe Netflix TV interface is constantly evolving as we strive to figure out the best experience for our members. For example, after A/B testing, eye-tracking research, and customer feedback...",https://medium.com/netflix-techblog/crafting-a-high-performance-tv-user-interface-using-react-3350e5a6ad3b?source=collection_home---4------15---------------------,0,netflix,"vue,angular,react,javascript,frontend,reactjs",,2017-01-12,0
Netflix Conductor: A microservices orchestrator,The Netflix Content Platform Engineering team runs a number of business processes which are driven by asynchronous orchestration of tasks executing on microservices. Some of these are long running pro...,https://medium.com/netflix-techblog/netflix-conductor-a-microservices-orchestrator-2e8d4771bf40?source=collection_home---4------17---------------------,0,netflix,"javascript,cloud,frontend,docker,backend",,2016-12-12,0
NetflixOSS: Announcing Hollow,We software engineers often face problems that require the dissemination of a dataset which doesn’t fit the label “big data”. Examples of this type of problem include:When faced with these we usually ...,https://medium.com/netflix-techblog/netflixoss-announcing-hollow-5f710eefca4b?source=collection_home---4------18---------------------,0,netflix,python,,2016-12-05,0
More Efficient Mobile Encodes for Netflix Downloads,"Last January, Netflix launched globally, reaching many new members in 130 countries around the world. In many of these countries, people access the internet primarily using cellular networks or still-...",https://medium.com/netflix-techblog/more-efficient-mobile-encodes-for-netflix-downloads-625d7b082909?source=collection_home---4------19---------------------,0,netflix,,,2016-12-01,0
Netflix Chaos Monkey Upgraded,"We are pleased to announce a significant upgrade to one of our more popular OSS projects. Chaos Monkey 2.0 is now on github!Years ago, we decided to improve the resiliency of our microservice architec...",https://medium.com/netflix-techblog/netflix-chaos-monkey-upgraded-1d679429be5d?source=collection_home---4------22---------------------,0,netflix,ruby,,2016-10-19,0
To Be Continued,"by Hossein Taghavi, Ashok Chandrashekar, Linas Baltrunas, and Justin BasilicoOur objective in improving the Netflix recommendation system is to create a personalized experience that makes it easier fo...",https://medium.com/netflix-techblog/to-be-continued-helping-you-find-shows-to-continue-watching-on-7c0d8ee4dab6?source=collection_home---4------23---------------------,0,netflix,"javascript,ruby,frontend",,2016-10-12,0
"Zuul 2 : The Netflix Journey to Asynchronous, Non-Blocking Systems","We recently made a major architectural change to Zuul, our cloud gateway. Did anyone even notice!?Probably not… Zuul 2 does the same thing that its predecessor did — acting as the front door to Netfli...",https://medium.com/netflix-techblog/zuul-2-the-netflix-journey-to-asynchronous-non-blocking-systems-45947377fb5c?source=collection_home---4------0---------------------,0,netflix,"javascript,frontend",,2016-09-21,0
IMF: An Open Standard with Open Tools,"As Netflix expanded into a global entertainment platform, our supply chain needed an efficient way to vault our masters in the cloud that didn’t require a different version for every territory in whic...",https://medium.com/netflix-techblog/imf-an-open-standard-with-open-tools-d85a665162a6?source=collection_home---4------1---------------------,0,netflix,"ruby,react,tensorflow,python,machinelearning,javascript,frontend",,2016-09-15,0
Netflix OSS Meetup Recap — September 2016,"Last week, we welcomed roughly 200 attendees to Netflix HQ in Los Gatos for Season 4, Episode 3 of our Netflix OSS Meetup. The meetup group was created in 2013 to discuss our various OSS projects amon...",https://medium.com/netflix-techblog/netflix-oss-meetup-recap-september-2016-937355669a0c?source=collection_home---4------2---------------------,0,netflix,"ruby,react,tensorflow,python,machinelearning,javascript,frontend",,2016-09-14,0
Netflix Data Benchmark: Benchmarking Cloud Data Stores,"The Netflix member experience is offered to 83+ million global members, and delivered using thousands of microservices. These services are owned by multiple teams, each having their own build and rele...",https://medium.com/netflix-techblog/netflix-data-benchmark-benchmarking-cloud-data-stores-7266186ded11?source=collection_home---4------3---------------------,0,netflix,"mysql,ruby,db,database,docker,python,django,php,sql,backend",,2016-09-01,0
Engineering Trade-Offs and The Netflix API Re-Architecture,"Netflix’s engineering culture is predicated on Freedom & Responsibility, the idea that everyone (and every team) at Netflix is entrusted with a core responsibility. Within that framework they are free...",https://medium.com/netflix-techblog/engineering-trade-offs-and-the-netflix-api-re-architecture-64f122b277dd?source=collection_home---4------5---------------------,0,netflix,,,2016-08-23,0
Distributed delay queues based on Dynomite,"Netflix’s Content Platform Engineering runs a number of business processes which are driven by asynchronous orchestration of micro-services based tasks, and queues form an integral part of the orchest...",https://medium.com/netflix-techblog/distributed-delay-queues-based-on-dynomite-6b31eca37fbc?source=collection_home---4------6---------------------,0,netflix,"cloud,docker,backend",,2016-08-16,0
Netflix and Fill,"Tomorrow we’ll release another much-anticipated new series, The Get Down. Before you can hit “Play”, we have to distribute this new title to our global network of thousands of Open Connect appliances....",https://medium.com/netflix-techblog/netflix-and-fill-c43a32b490c0?source=collection_home---4------7---------------------,0,netflix,"python,backend,json",,2016-08-11,0
Automated testing on devices,"As part of the Netflix SDK team, our responsibility is to ensure the new release version of the Netflix application is thoroughly tested to its highest operational quality before deploying onto gaming...",https://medium.com/netflix-techblog/automated-testing-on-devices-fc5a39f47e24?source=collection_home---4------8---------------------,0,netflix,,,2016-08-10,0
Building fast.com,"On our company blog in May, we introduced fast.com, our new internet speed test. The idea behind fast.com is to provide a quick and simple way for any internet user to test their current internet spee...",https://medium.com/netflix-techblog/building-fast-com-4857fe0f8adb?source=collection_home---4------9---------------------,0,netflix,,,2016-08-09,0
Protecting Netflix Viewing Privacy at Scale,"On the Open Connect team at Netflix, we are always working to enhance the hardware and software in the purpose-built Open Connect Appliances (OCAs) that store and serve Netflix video content. As we me...",https://medium.com/netflix-techblog/protecting-netflix-viewing-privacy-at-scale-39c675d88f45?source=collection_home---4------10---------------------,0,netflix,"animation,python,frontend,docker",,2016-08-08,0
Introducing Winston — Event driven Diagnostic and Remediation Platform,Netflix is a collection of microservices that all come together to enable the product you have come to love. Operating these micro services is also distributed across the owning teams and their engine...,https://medium.com/netflix-techblog/introducing-winston-event-driven-diagnostic-and-remediation-platform-46ce39aa81cc?source=collection_home---4------11---------------------,0,netflix,android,,2016-08-05,0
Vizceral Open Source,"Previously we wrote about our traffic intuition tool, Flux. We have some announcements and updates to share about this project. First, we have renamed the project to Vizceral. More importantly, Vizcer...",https://medium.com/netflix-techblog/vizceral-open-source-acc0c32113fe?source=collection_home---4------12---------------------,0,netflix,,,2016-08-03,0
Netflix Billing Migration to AWS — Part III,"In the billing migration blog post published a few weeks ago, we explained the overall approach employed in migrating our billing system to the cloud:In this post, the database migration portion will ...",https://medium.com/netflix-techblog/netflix-billing-migration-to-aws-part-iii-7d94ab9d1f59?source=collection_home---4------13---------------------,0,netflix,"android,java",,2016-08-01,0
Distributed Resource Scheduling with Apache Mesos,"Netflix uses Apache Mesos to run a mix of batch, stream processing, and service style workloads. For over two years, we have seen an increased usage for a variety of use cases including real time anom...",https://medium.com/netflix-techblog/distributed-resource-scheduling-with-apache-mesos-32bd9eb4ca38?source=collection_home---4------14---------------------,0,netflix,,,2016-07-29,0
Netflix Billing Migration to AWS — Part II,This is a continuation in the series on Netflix Billing migration to the Cloud. An overview of the migration project was published earlier here:This post details the technical journey for the Billing ...,https://medium.com/netflix-techblog/netflix-billing-migration-to-aws-part-ii-834f6358126?source=collection_home---4------15---------------------,0,netflix,"android,java",,2016-07-20,0
